"","Album","Song","Lyrics"
"45","Frost God "," hop out "," Lil' Leandoer Luckaleannn SBE 2003 SBE Bitch I'm flexed up, I'm cashed out I hop out, roll up Tinted windows on the shits, you know I got my bands up Tinted windows with my bitch she riding with her xans up I'm flexed up, I'm cashed out I hop out, roll up Tinted windows on the shits, you know I got my bands up Tinted windows with my bitch she riding with her xans up Tinted windows 'round my fucking bitch And I'm still riding in the 6 And I'm still trapping like a bitch Your bitch on my motherfucking dick I still ride around the town on some tents Boys can't fuck with me cause they some simps Come up in the booth and heat the shit I serve your mommy and daddy cause I'm the shit Tinted windows on the shits, you know I got my bands up Tinted windows with my bitch she riding with her xans up I'm flexed up, I'm cashed out I hop out, roll up Tinted windows on the shits, you know I got my bands up Tinted windows with my bitch she riding with her xans up I'm bossed up, cashed out Rocks up, stacks out It's a dream, shawty you already know I'm fucking cashing out Scarface bitch, now you know there ain't no backing out Hit em up don't fuck around All these boys wanna come around They used to hear me, they don't make a sound SBE in your town tonight You know we bring ice out You know shawty has stacks out Lean just brought that pack out bar and we sippin' I'm flexed up, I'm cashed out I hop out, roll up Tinted windows on the shits, you know I got my bands up Tinted windows with my bitch she riding with her xans up I'm flexed up, I'm cashed out I hop out, roll up Tinted windows on the shits, you know I got my bands up Tinted windows with my bitch she riding with her xans up Xans out, bands out You know how we do Yung Leandoer, Luckaleannn"
"46","Frost God "," hennessy sailor moon "," I love how she dancing, got me feeling for you You say that you love me, I don't know if it's true When I go to sleep all I ever see is you I can be your savior, everything that we've been through I love how she dancing, got me feeling for you You say that you love me, I don't know if it's true When I go to sleep all I ever see is you I can be your savior, everything that we've been through I be grinding making money, it's for me and you I love the way you dancing and your top is see through We can go up to the stars, see clouds and fall through Money in my pocket and you know I want you I've been busy, got so much work, I can't always be with you Percocets my system, when I go to sleep I know it's you When I was in the hospital I saw you I know what you're feeling inside cause I feel you I gotta stay true, my money rain blue Hennessy and Sailor Moon, I just wanna be with you I know what you're feeling inside cause I know I feel you My money rain blue, Hennessy and Sailor Moon I love how she dancing, got me feeling for you You say that you love me, I don't know if it's true When I go to sleep all I ever see is you I can be your savior, everything that we've been through I love how she dancing, got me feeling for you You say that you love me, I don't know if it's true When I go to sleep all I ever see is you I can be your savior, everything that we've been through She shouldn't have to ask, whatever she wants I stay up till dawn, barbwire on my arm They won't see me fall, they won't see me fall I don't care at all, I'm a young rockstar Living in the dark, living in the dark Leandoer the God, we've been going hard Ever since she called, I don't have a heart I went to the stars What you want from me? I can get it for you Get it for you You don't want me, do you? You don't want me, do you? Know what I'll do to you I love how she dancing, got me feeling for you You say that you love me, I don't know if it's true When I go to sleep all I ever see is you I can be your savior, everything that we've been through I love how she dancing, got me feeling for you You say that you love me, I don't know if it's true When I go to sleep all I ever see is you I can be your savior, everything that we've been through"
"47","Frost God "," cashin "," Cashin We be braggin My pants be sagging I'm getting stacks I be cashin I hit the mall Yes I ball Shawty call Cashin We be braggin My pants be sagging I'm getting stacks I be cashin I hit the mall (Adamn) Yes I ball Shawty call Bitch I'm out in Europe like I'm out here on vacation But I'm doing shows touring across the nation If you want it, gotta get it like it ain't no waitin' Bitch I want it right now, I don't got no patience Niggas be broke cos they got all the patience Don't know the currency so I don't know what I'm paying Bitch I'm Adamn, that is what I'm saying All this foreign money I can't count what I'm making There's me, Lean, whitearmor and we out here baby I don't want no baby, killavesi is my baby Bitch I'm Adamn, all the hot boys they like hating I can't save no thot cos these bitches they got rabies Cashin We be braggin My pants be sagging I'm getting stacks I be cashin I hit the mall Yes I ball Shawty call I be cashin Shawty splashin What you know about Lean, I'm getting stacks I'm on the frozen throne I might just catch it Angels falling in my soul, money stacking, gucci cologne Got cash got bags my bros Many men wanna kill me, I don't know Why they trying to get me I just blow Money and coke up in my nose Percs in my system, I'm never slow Golden noise running round the floor I sit down in the frozen throne She called me up and called me on the phone She fucked me over once, someone that I know I be getting dough Soldiers from white snow Moola in my rover With Adamn killing my soul Fuck with Lean I break your bones Fuck with Lean I break your bones Moola in my rover"
"48","Frost God "," crystal city "," Hurt me, you can never hurt me Hurt me, you can never hurt me Hurt me, you can never hurt me Hurt me, you can never hurt me Leandoer Cool wind over my face, I need peace Cool city, crystal living, I can't leave Diamonds dancing on ice, look just like Bambi I'm a vampire, you can never hurt me Cool wind over my face, I need peace Cool city, crystal living, I can't leave Diamonds dancing on ice, look just like Bambi I'm a vampire, you can never hurt me Fucking these bitches, I'm out of control Walkin' the bank and got coke on my clothes Robitussin on me, when I'm fuckin' a hoe Trippin' on flo's, sap of them both Got one Xanax, and three to go Bitch, that's how it goes Bitch, I'm a ghost Like Bruce Willis, I am a ghost (Hit it from the back, then I have to go) Coppin' these Rolls, euros my nose Live up the road, fuck what you know I just broke up with my girlfriend, now I am back on the go Gotta stack these stacks, when I'm fuckin' her slow I'm single tonight, tell all your friends So I got bitch hoes Bitch, I'm a ghost Bitch, I'm a ghost Leandoer! Cool wind over my face, I need peace Cool city, crystal living, I can't leave Diamonds dancing on ice, look just like Bambi I'm a vampire, you can never hurt me Cool wind over my face, I need peace Cool city, crystal living, I can't leave Diamonds dancing on ice, look just like Bambi I'm a vampire, you can never hurt me Sad Boys, A$AP Mob, we're up in this bitch Young Trap Lord on the block Fuck with it, get money, I got a lot All of my niggas is real All of my niggas is trill And dammit I'm taking the wheel Leany is gone off a pill All these diamonds on me dancin' On ice like I'm Bambi Pool party at the mansion Trophy bitches fuck a Grammy Sittin' pretty in a Bentley Rest In Peace, my nigga Yammy (Rest In Peace, my nigga Yammy) (Rest In Peace, my nigga Yammy) In Miami yellow earrings, Ferg just got a new pair in Rare garments my appearance, word to my momma Sharon Smoking dope, I'm rolling loud, I'll be in the crowd Diamonds dancing on me now, even when I smile Cool wind over my face, I need peace Cool city, crystal living, I can't leave Diamonds dancing on ice, look just like Bambi I'm a vampire, you can never hurt me Cool wind over my face, I need peace Cool city, crystal living, I can't leave Diamonds dancing on ice, look just like Bambi I'm a vampire, you can never hurt me Cool wind over my face, I need peace Cool city, crystal living, I can't leave Diamonds dancing on ice, look just like Bambi I'm a vampire, you can never hurt me Hurt me, you can never hurt me Hurt me, you can never hurt me Hurt me, you can never hurt me Hurt me, you can never hurt me"
"49","Frost God "," kirby "," Watch, my ring Cost more than drugs, it seems I'm falling in love, Kirby my drink Money on deck, meet me in the back Remixing and pouring the drink (remix) Leandoer fuck what you think (fuck what you think) Mind fucking these girls like a shrink (shrink) Cannons, my balls make you sink (you sink) I'm flipping the pack, money pink (flipping) SBE in this bitch I got stink (SBE) Came thru' with a rug made of mink (mink) I'm geeking, my Balmain's all pink (geeking) Whitearm, smoking dope, make it stink (smoking dope) They call me up when I link Bitch I just left a new flight I'm falling I'm falling on sight I think that she might be my type (my type) Prada shades on my face, I'm alright My chain black and my diamonds white Fuck all the fame and the hype Lean Watch, my ring Cost more than drugs, it seems I'm falling in love, Kirby my drink Money on deck, meet me in the back My watch, my ring Cost more than drugs, it seems I'm falling in love, Kirby my drink Money on deck, meet me in the back"
"50","Frost God "," head 2 toe "," Head to toe, Louis V and Rafs 127, yeah we ball like that Going plus getting stacks, but I ain't into math I be in a castle making calls like that Head to toe, Louis V and Rafs 127, yeah we ball like that Going plus getting stacks, but I ain't into math I be in a castle making calls like that What you want, call Bladee, he gon' get it for you, facts What you need, want coke, got a weed filled bag Been through hell, seen ghosts, you can't walk my path I've been to clouds, need a perc, and double cup my hand Popping pills like Scooby snacks, seeing colors, apple jacks Please, I can't excuse my being, SBE roll off a bean Gucci, Louis, on my tee, shawty wanna get with me They knew we were a problem they knew not to fuck with lean Head to toe, Louis V and Rafs 127, yeah we ball like that Going plus getting stacks but I ain't into math I be in a castle making calls like that Head to toe, Louis V and Rafs 127, yeah we ball like that Going plus getting stacks but I ain't into math I be in a castle making calls like that 12 skulls, bathed in blood 10 pills, I'm destroyed I'm up, don't need love Louis V, black rug Ice king, I'm back up Get back bitch, back up She said I'm fucked up I'm Gucci, draped up Head to toe, Louis V and Rafs 127, yeah we ball like that Going plus getting stacks but I ain't into math I be in a castle making calls like that Head to toe, Louis V and Rafs 127, yeah we ball like that Going plus getting stacks but I ain't into math I be in a castle making calls like that"
"51","Frost God "," get it back "," Get it back Get it back Get it back Diamonds on my wrist, give me an ice attack Pull up to the club, and I'm back Get it back, get it back Get it back, get it back Diamonds on my wrist, give me an ice attack Tatts on my wrist, neon coloured stacks Bitch she gave me heart attack, but I'm back, yes I'm back Yes I'm back Yes I'm back Yes I'm back Yes I'm back I've been around the globe so many cities, man I've fucked a girl in every state but I don't give a fuck I been with my mans, peach coloured grams Pull up to the club and my ice gave me an ice attack I be with Bladee, Sherman n em Pull up with Whitearmorr and we counting blue M&M's I was out here in Cali I was with Bally Pull up in a 'Rari I don't like the talking I don't like the talking All my dogs be barking She call me yeah she stalk me She call me yeah she stalk me She on me It's a good day I just poured a 4 up in my cup Spent some money then I get it back Diamonds on my wrist, give me an ice attack Pull up to the club, and I'm back Get it back, get it back Get it back, get it back Diamonds on my wrist, give me an ice attack Tatts on my wrist, neon coloured stacks Bitch she gave me heart attack, but I'm back, yes I'm back Lean"
"52","Profound Sadness 2004"," nekobasu "," (Sausage) Nekobasu, Iceland, we hangin' down in the Iceland Nekobasu, Iceland, we hangin' down in the Iceland Nekobasu, Iceland, we hangin' down in the Iceland Nekobasu, Iceland, we hangin' down in the Iceland Glass balls of ice, man, diamond knife hand Astro-astro-boys Iceland, Sadboys will be missed me Me and Baba in disguise, man, we consist in that mist Sinful when the city turns to night-land, crocodile, bucket hat Check the price, man, check the price, man Came in ridin', came in with the right hand, we come through Sad Boys, we don't need you We bleed tears, we don't see you We're a velociraptor, we don't feed fools We eat you, like seafood Sushi and that tofu, Sprite and wine for my whole crew Shawty, you with Lean Shawty, you wanna come with me? Shawty-shawty, you with Lean Shawty, you wanna come with me? G-g-galaxy torn away Bitch, I'm in the fuckin' shade Up in the clouds, cause I'm finna get faded Galaxy torn away, bitch, I'm in the fucking shade Up in the clouds, cause I'm finna get faded I stack this money, Northface everyday Getting stacks, getting paid Living good, drop top the Chevrolet Fruit Loops and them Pop Rocks Got the Coco Pops and the crack rocks Grease chick up in Bangkok I've been every where Yung Lean don't even care I've been everywhere Yung Lean don't even care All them shit shades Ten chains, six million Olimpic gold rings I'm the big boss, strange player BBC shirts in every layer In every layer Glass balls of ice, man, diamond knife hand Astro-astro-boys Iceland, Sadboys will be missed me Me and Baba in disguise, man, we consist in that mist Sinful when the city turns to night-land, crocodile, bucket hat Check the price, man, check the price, man"
"53","Profound Sadness 2004"," buildings "," Leandoer Euros in my bank account Got foreign diamonds on my plate Swervin, all these bank accounts Go jump on the wave, it's too late Foreign foreign bitch I'm foreign Let these fuckers know I'm up to date Shawty wanna celebrate but All my boys got stacks of cake Picked up pepper on the streets, all white Neon floating on the floor, jetski Sadboys tattoo in Times New Roman I let em know not to hold me, I let them know I'm the omen Dont get pissed if you jack my style Cause I know you're too slow man Hannibal Lecter, ballin inspector 100 dollar bills, poppin pills, sippin nectar 100 million films on my TV projector Leave the bodies in my jetski Pick them up imma collector Bitch I’m Harmony Korine In my whole life I'm the director And my team Sadboys get the check bruh Don't forget to sign off, killed the rap game Leave the body with the spine off Lean, Lean, Leandoer GTBSB in the building Shawty wanna fuck But you don't know how I be feelin Rolex in my Rari GTB that's army Shawty I be ballin Shawty I be ballin GTB SB in the building Shawty wanna fuck But you don't know how I be feelin Rolex in my Rari GTB that's army Shawty I be ballin Shawty I be ballin Ballin, ballin, GTB that's army Pullin up that Rari Everything be foreign Running with them Sadboys Money we be pourin That hoe, she be boring Foreign we be tourin Robotic instincts got metallic dreams Burberry tees, walking out, you and me 10 soda cans in if you wanna drink Razor blade in my fist You can get extinct I got glue on my Ferragamo linen shirt In my house but it's feelin like I'm in a church Barbed wire on the fence you can't get inside Got a wall full of knives if you wanna die CDG tee shirt I got no heart You see me, my shoes cost a gold bar GTBSG shield gang boys I was broke, I got paid Then I soared up"
"54","Profound Sadness 2004"," marble phone "," Flexing, flexing, Lean, flexing like a rubber band I be ballin', I be ballin', all this money in my hand Alcohol in everything, Sad Boys, that's the dark man G-T-B-S-B, Sad Boys leave your body with the others man Leave 'em in Netherlands See me, see me in that Rolls Royce I've been counting all this money with my team, Sad Boys Worldwide Entertainment Lean go harder, name any lame rapper, Lean much smarter See me flying at you, living large, I'm living larger I love this life, this ain't no departure Swedish hard, but I'm harder I've been out there working, Imma, Imma work harder North Face bucket hat, hunna, hunna’s in my armor So many plants, Lean could be a gardener They step up to me and my partners I've been out there, I've been working, Imma work harder Rose on plants make me train sharper 17 years old, I'm going farther Getting farther because it's me and Kreayshawn Yung Lean bitch it's me I run the game Tell your weapon let the rest run through your brain Kreayshawn, Kreayshawn When you coming back man you must be off I was never on Tell my friends who think I'm famous, no they're wrong I'm feeling sad, the label left me cause I'm a mom Now I've got a future but I'm still looking for where I belong I cry my ass off every night but it's all inside I hold my fist up and I shake it to them cloudy skies Why me?, why me?, why am I so fly? All this pressure to be cool makes me a sad guy Riding, smoking dart packs in the streets Wanna get rid of me, I've been popping Ritalin See me up on everything Sad boys style, good as fuck I don't need no education, just a basement and some thugs Louis duffle bags, duffle bags in my trunk See me in the fucking club, at the back, blowing doves Sad Boys is my team, no you cannot join Flipping my change, I'm so fly for definite, flipping my coin, ripping your groin Keeping these songs, emotional boys for life Don't be so cold, sus the phones, telephone, gave right this earth phone Demons inside me, that is so wrong Hoes on my lap, wish I could take the time back Wake up and she's gone Stupid chains, ice in my veins I'm Misaki when it rains, woke up and felt no pain I'm happy with my friends, just want to remain the same Catch me sipping champagne Too futuristic for all you lames Inhumane, think I give a fuck what other people say? Got my team with me, you should turn the other way Don't talk to me cause you know I don't talk much Rolling up the Dutch, I pull up don't touch When the room shines, I don't close my eyes"
"55","Profound Sadness 2004"," kyoto "," Do me, I'mma do me I'mma make mine, I'mma make mine I fuck the shine, I said fuck the shine Bitch, I grind, bitch, I grind Yung Lean swerving in, see me fucked up See me swervin' through, they want me locked up Been locked up, in my own mind My thoughts will never be shallow I got an empire of emotion Squad see me crusin', crusin' in my go kart I'm War hoe, I'm Warhol I'm Wario when I'm in Mario Kart Topping the charts, ace in my cards Choppa my locka when I'm writing these bars Koka Kola veins, I'm insane Trip through memory lane Out in Narashino and I see my own white shadow A tad too close, rad with a bad diagnose Coke-filled nose, too weird for them other fuckboys Catch Lean and Sad Boys Out in Europe, sippin' cristal I'm smoking loud with my lost boys All this money don't make me sad though Rubber bands in my pants bro Don't close your eyes and lean back though Ya'll ain't ready for the lean attack though Lean, lean, lean, younging with my Team Pumping RZA, eating pizza Man I'm living my dreams, living my dreams (living in my dreams) (Fucked your bitch in the...) Do me, I'mma do me I'mma make mine, I'mma make mine I fuck the shine, I said fuck the shine Bitch, I grind, bitch, I grind Yung Lean swerving in see me fucked up See me swervin' through, they want me locked up Been locked up, in my own mind My thoughts will never be shallow I'mma make mine, I'mma make mine I fuck the shine, I said fuck the shine Bitch, I grind, bitch, I grind Yung Lean swerving in see me fucked up See me swervin' through, they want me locked up Been locked up, in my own mind My thoughts will never be shallow My life I've comprehended, it's not a lie I'm dependent on my team When I send it, I spit fire, I'm an element I’m everything, you're irrelevant Ta-take it easy, yeah we getting it BBC pants yeah I’m getting rich All this love I'm melting it Don’t let me down I’m not meant for it If you ask me, I might come for it I'll take you back to the rain forest My heart and soul, yeah you tore it I don't want to be here, my life's more of it There's more of it S-A-D B-O-Y-S See me in the club with it tatted on my chest S-A-D B-O-Y-S See me in the cut with it tatted on my chest See me on the bus, blowing sesh Nothing less, we the best, fuck the rest Water in my lungs, finna quest, I won't hit the earth Fire, water, dirt, too turnt, too burnt Make mistakes, I guess I'll never learn See, see, see that's my firm Nike, Nike on my shirt Bubbles bubbles, blowing bubbles But I guess they'll never burst Empire of my state of mind I'mma do me, I'mma make it mine I say fuck the shine, I say fuck the shine Bitch I grind, bitch I grind, I'm hard to find Do me, I'mma do me I'mma make mine, I'mma make mine I fuck the shine, I said fuck the shine Bitch, I grind, bitch, I grind Yung Lean swerving in see me fucked up See me swervin' through, they want me locked up Been locked up, in my own mind My thoughts will never be shallow Do me, I'mma do me I'mma make mine, I'mma make mine I fuck the shine, I said fuck the shine Bitch, I grind, bitch, I grind Yung Lean swerving in see me fucked up See me swervin' through, they want me locked up Been locked up, in my own mind My thoughts will never be shallow Do me, I'mma do me I'mma make mine, I'mma make mine I fuck the shine, I said fuck the shine Bitch, I grind, bitch, I grind Yung Lean swerving in see me fucked up See me swervin' through, they want me locked up Been locked up, in my own mind My thoughts will never be shallow Do me, I'mma do me I'mma make mine, I'mma make mine I fuck the shine, I said fuck the shine Bitch, I grind, bitch, I grind Yung Lean swerving in see me fucked up See me swervin' through, they want me locked up Been locked up, in my own mind My thoughts will never be shallow"
"56","Profound Sadness 2004"," crystalized snow ","(x2) Shawty shawty drop it low Shawty wanna show off All white snow All white crystallized snow Bitch It's Sadboys at the top Make it rain make it hot Double cup Pop and stop Polo shirt on me like Underwater you Bring me down to the underwater I don't see you anymore I'm not wearing swim goggles I got Kool aid, Kool aid Stacks, I get paid You don't know me So don't say my name My friends are real I don't fuck with lames Black pants and a purple ice cream belt It's hot in the summer My ice cream melts We roll (x2)"
"57","Profound Sadness 2004"," king of the darkness "," I don't feel no pain I don't care cause I don't feel no pain I don't really care I don't feel no pain I don't care cause I don't feel no pain Hate, love, driving Ford Drop top, rockin' Ralph Lauren Hat to upgrade, we love soup pourin' Milk and cereal like every mornin' No lies in my mouth I don't speak corny Stockholm ridin' for lean, don't we? Tell your friends that I'm dead, homie No soul, no life, just blood on me Keep my boys around, all you others bore me Don't talk to no one, don't steal my glory Fuck, fuck my glory, the whole world ignores me And I'm stuck in my room till that snorts it G-shock, G-shock round my wrist, wearing Gucci boots Looking at myself like ""why you wearin' that stupid human suit?"" I relive for recruit, I survive and I shoot Magic powers, I use, you hate me, I assume Don't give a fucks about you, being myself's kind of cool Everyplace on the news, Lean's always on the move I can't handle no booze, livin' my dreams, I need you If you talk that's on you, I brought Sweden back on the moon Feeling so worthless I don't feel ok I don't care cause I don't feel no pain I don't really care I don't feel no pain I don't care cause I don't feel no pain"
"58","Profound Sadness 2004"," motorola "," Gold on my wrist, phone in my pocket Gold on my wrist, phone in my pocket Gold on my wrist, phone in my pocket Phone in my pocket Gold on my wrist, phone in my pocket Gold on my wrist, phone in my pocket Gold on my wrist, phone in my pocket Phone in my pocket Alien face, tatted up Ballin', ballin', Swiss cup 'Dro cologne and I'm drunk 'Dro cologne and I'm drunk Pounds of Gucci on me, Gucci shoes on my feet I wanna see who you sleep, I wanna see who you sleep Sad mob, money Lean Sad gang, that's money team I look down, down to Earth See my reflection, what's it worth? Alien face, tatted up. Ballin', ballin', Swiss cup 'Dro cologne and I'm drunk 'Dro cologne and I'm drunk Gold on my wrist, phone in my pocket Gold on my wrist, phone in my pocket Gold on my wrist, phone in my pocket Phone in my pocket Gold on my wrist, phone in my pocket Gold on my wrist, phone in my pocket Gold on my wrist, phone in my pocket Phone in my pocket"
