"","Album","Song","Lyrics"
"30","Warlord"," fire "," It's ain't even my fault though? Fire F-f-f-f-fire Fire F-f-f-f-fire Flames, fire and a buyer Leandoer can't expire We walked in this, they sound like a choir Bitch I'm smokin' spirit flowers Cause you know it takes me higher My money speedin' no flat tire Over on this side it is drier Louis Vuitton sheets with flowers Helicopters round the windows Now I'm sippin' everything slow You would think i said that in the intro Im ridin' past you in that limo Sadboy gang, we some heroes Money bitches like flamingos Riding past you in that limo Xans on me, oh lord I stick my head out the window Fuck school, it made me sick All of my haters, they make me rich They warned me about this shit I'mma do this till I go extinct Bitches they know that its Yung Leandoer Straight from the sewer posted with Bladee Krueger Hit him and get him, I stack 'em, I rip 'em Just like my stacks, I got cash in my denim Salvation, bitch I need my medication (meds) Sadboy gang, bitch we one nation (SBE) Posted up celebrating, takin' flights like vacation Paper chasin', I keep 'em waitin' Bitch, you know that I keep 'em waitin' Fire, I'mma still live in the fire Leandoer can't expire We walked in this, they sound like a choir Cause you know I got that fire"
"31","Warlord"," stay down "," Way up Way up Some up I'm rollin' blowin away, the days look the same 10 pills in my pocket, I keep blowin' my faith R-r-rollin' down the window, white widow, fuck fame Forest fire, climbin' higher, real life, it can wait I'm rollin' blowin away, the days look the same 10 pills in my pocket, I keep blowin' my faith R-r-rollin' down the window, white widow, fuck fame Forest fire, climbin' higher, real life, it can wait I'm bound to stay down, stay down, stay down I guess I'm bound to stay down, stay down, stay down Girl, I'll be around, around, around Forever, I'll be around, around someway up Nitrous oxide, I've seen the world collide I lost count of all the times, she ask me why Ma-ma-magic in her eyes, Leandoer's paradise All my, all my, boys off drugs, I've been lost in this life Fire flames, color red, 'member recent times Stacks of shoes, got soo many, don't really know the 'mount When it's hot outside, I copped me some ice Travel in disguise, I see trouble in her eyes Mix it with Fanta not with Sprite, wings from Calvin Klein Forever I'll fly, all the times I remind Cause I'm way, way high up in the sky I got a white shirt and a tangerine belt I'm in a winter where the snow don't melt Cause I keep to myself Cause I keep to myself I'm rollin' blowin away, the days are the same 10 pills in my pocket, I keep blowin' my faith R-r-rollin' down the window, white widow, fuck fame Forest fire, climbin' higher, real life, it can wait I'm rollin' blowin away, the days look the same 10 pills in my pocket, I keep blowin' my faith R-r-rollin' down the window, white widow, fuck fame Forest fire, climbin' higher, real life, it can wait I'm rollin' blowin away, the days are the same 10 pills in my pocket, I keep blowin' my faith Rubber, rollin' down the window, white widow, fuck fame Forest fire, climbin' higher, real life, it can wait I'm bound to stay down, stay down, stay down I guess I'm bound to stay down, stay down, stay down Girl, I'll be around, around, around Forever, I'll be around, around someway up"
"32","Warlord"," eye contact "," Pull up in that Veyron goin' skrt-skrt (skrrt) Everyday shit fuck what you heard-heard I'm so high that I'm flyin' like a bird-bird (brrr) All of that I know is that it's her-her I, I am surfing on the earth I'm a surfer Draped in that Gucci scarf my phone going berserk I don't do no eye contact my vision blurred-blurred I'm a demon like a fur-fur, they think I'm absurd-surd But when I enter the galaxy they are li-like word-word I'm too fucked up, she said when I hurt her I don't have no feelings left, I don't wanna hurt her I am surfing on the earth I'm a surfer Look into the sky and I see myself I don't wanna fall down, I don't need your help I just popped a pill I can't control myself I'm in that forest and my life is like a fairy tale Diamonds in my veins, I'm sipping ginger ale Hate in my heart, getting guided by elves I'm a lion in this shit everyone else is stale (stale, stale) Smoke still coming out my mouth when I exhale (yeah) Look into the sky and I see myself I don't wanna fall down, I don't need your help Shout out to my enemies, I wish you well Shout out to my enemies, I wish you well"
"33","Warlord"," more stacks "," Shawty, roll up, I'm a smoker We will fly high they below us Bitch, Im runnin' on the road to the money bus My wings fold up, smokin' winter lungs My boys roll up, rollin' honey buns I got pills look like rainbows in my tour bus More cash, more stacks and there's more for us Money foreign in my pocket and it's for us I got bands in my Louis bags, bags under my eyes Lean up in the club I'm smoking wind and gettin fried Fuck these other guys Imma do this till I die Pink polo dirty stacks 24/7, 9-5 I need a new ring and i need another pill Still in Yoshi City rollin rollin down a hill I need a new high and I need a new life I need a hundred million roses on me when I die Shawty, roll up, I'm a smoker We will fly high they below us Bitch, Im runnin' on the road to the money bus My wings fold up, smokin' winter lungs My boys roll up, rollin' honey buns I got pills look like rainbows in my tour bus More cash, more stacks and there's more for us Money foreign in my pocket and it's for us For us, for us More stacks for us Shawty, roll up, I'm a smoker We will fly high they below us Bitch, Im runnin' on the road to the money bus My wings fold up, smokin' winter lungs My boys roll up, rollin' honey buns I got pills look like rainbows in my tour bus More cash, more stacks and there's more for us Money foreign in my pocket and it's for us For us, for us More stacks for us"
"34","Warlord"," af1 s "," Six Air Force 1's, I got Air Force on Put the mask on shawty, shawty what you want? Six Air Force 1's, I got Air Force on Put the mask on shawty, shawty what you want? Six Air Force 1's, I got Air Force on Put the mask on shawty, shawty what you want? Six Air Force 1's, I got Air Force on Put the mask on shawty, shawty what you want? B-bitch named Lean, Emperor of the city Silver rings on, sitting on 50 Blowing on Winter, icy like a stunner Looking like Winter, temperature like the summer Chain like a seahorse, Is that really Leandoer? All white Dior, all I wear is Dior Catch me on my Samsung, SBE anthem I be in the night creeping round' like the phantom Six Air Force 1's, I got Air Force on Put the mask on shawty, shawty what you want? Six Air Force 1's, I got Air Force on Put the mask on shawty, shawty what you want? Six Air Force 1's, I got Air Force on Put the mask on shawty, shawty what you want? Six Air Force 1's, I got Air Force on Put the mask on shawty, shawty what you want? Airbrushed, Air ice like I’m 19 Light speed, colour, lime green look like ice cream Light beam, call it light stream or you’ll white beam Five keys or my eyes bleed on the Nikes Headlock, scope red dot, It’s a head shot Shell shock, do the air-drop, I got dead stock Flow like purple drugs sprite, that's my blood type I wish none of this was real life, but it's sunlight You don't know what I'm up to We don't talk about it 'less you do Got a fight crew, we sky team Shoot around town, got bad dreams It’s weed and purple we up to Just got a bunch of em’ Nike shoes For I make big money, my own crew too We the Sadboys and we’ll fuck you A-A-Air Force 1's, I got Air Force on Put the mask on shawty, shawty what you want? Six Air Force 1's, I got Air Force on Put the mask on shawty, shawty what you want? Six Air Force 1's, I got Air Force on Put the mask on shawty, shawty what you want? Six Air Force 1's, I got Air Force on Put the mask on shawty, shawty what you want?"
"35","Warlord"," hocus pocus "," All I roll is potent, we stay golden We gone hocus pocus, they think they know us I'm flyin' in a lotus, in a Range Rover Is my life over? Take, take, take, take Take control of, take control of me Take control of Lean, take control of me All I roll is potent White powder like a hill, take control of me When it hits my body, you know there's no stoppin' lean I don't like red, paint the roses green Put a price up on my head, there's no controllin' me I thought I was dead, but I'm livin' free Walk up in the spot, bitch, it's SBE Stack the money green, turn it into leaves Six Air Force on my feet look like a centipede All I roll is potent, we stay golden We gone hocus pocus, they think they know us I'm flyin' in a Lotus, in a Range Rover Is my life over? Is, is it over? Never will I rise to fall, I've seen that light from very far I pack my bag, I pack my bag, bet you could never match the stars Keep my boys 'round, they watch my back Follow the lights, we in the cab Hash is from uzbekistan, I ball like asics 'cross the land You see my face, I see your hands She don't want to understand, but I have a plan Mixing alcohol and xans, when I'm with my gang You can find me where I stand, Disney wonderland I don't ever get attached, doesn't work like that Doesn't work like that Black bracelet, never show facesTwo pills runnin' round in the matrix Never show faces, never show faces Two pills runnin' round in the matrix All I roll is potent, we stay golden We gone hocus pocus, they think they know us I'm flyin' in a Lotus, in a Range Rover Is my life over? Is, is it over? All I roll is potent, we stay golden We gone hocus pocus, they think they know us I'm flyin' in a Lotus, in a Range Rover Is my life over? Is, is it over? Lotus, Ranger Rover, is, is, it over? Take, take, take, take Take control of, take control of me Take control of Lean, take control of me Yeah, it takes control of me"
"36","Warlord"," shawty u know what it do "," Shawty, you know what it do Wrist links when I come through I finna take 'em to the moon I fly up like a balloon All white linen, paint it true Shawty, you know what it do Smokin' double, give me two Shawty, you know what it do I don't give no fucks 'bout you I take it all, can never lose Only myself for my trues Lovin' this shit since I was two Got helicopters on my roof I'm hiding far away from you Sad Mob, we don't fuck wit fools I’m in the snow sipping Grey Goose Double Gs on my shoe Gs on my shoes Shawty, you know what it do Wrist links when I come through I finna take 'em to the moon I fly up like a balloon All white linen, paint it true Shawty, you know what it do"
"37","Warlord"," miami ultras "," I’m not for you I’m not, looking for I’m not for you I don't want to I’m not for you I’m not looking for I’m not for you I don't want to Pop, pop, pop, drop this top, top, top I roll like a rock, rock n roll to the top I dont give a motherfuck, watchin' Star Wars smokin' pot I take what I got, I live till it stops Chop, chop chop, all my lungs stay rot I take what I got, you hate that you're not Like me and me I don't give a motherfuck What I am, what I'm not, polo down to my socks What person, they can't stop, I fly to the top F-f-fuck what you got, I'm off a pill, rollin' like a rock White diamonds countin' guap, I got marble on my watch I got slam doors out the front, I'll keep goin' till I'm out I got pockets like the plug, I'm movin' 'round all day Fade to grey, everythin' can't stay I smoke so much, went away I'm in leanworld, l-l-let my mind stay Whichever today, I love my brothers, we gon' slay I’m not looking for you I’m not looking for you I miss some places, I wish we lived on another earth You think you hate me, I know that it hurts Burn, burn, burn, my turn, turn, turn Burn, burn, burn, my turn, turn, turn I miss some places, I wish we lived on another earth You think I hate you, I know that it hurts I burned, burned, burned, my turn, turn, turns Take a way and yearn, yearn, yearn I’m not looking for you I’m not for you I’m not for you I’m not looking for you I’m not for you I’m not for you Pop, pop, pop, drop this top, top, top I roll like a rock, rock n roll to the top I dont give a motherfuck, watchin' Star Wars smokin' pot I take what I got, I live till it stops Chop, chop chop, all my lungs stay rot I take what I got, you hate that you're not Like me and me I don't give a motherfuck What I am, what I'm not, polo down to my socks I’m not looking for you I’m not for you I’m not for you I’m not looking for you I’m not for you I’m not for you"
"38","Warlord"," sippin "," I'm sippin', over 100 degrees Posted with my boys, sippin' Hennessey I'm trippin' shawty down on her knee's Everything be okay I feelin' good in the breeze I get it lit man, You know we overseas Fly to Dubai, we'll be back in a week Feelin' like a hitman, you won't barely see me I'm gone in the wind, hiding in the streets Yeah I'm sippin' Yeah I'm sippin' lean On the highway, hope I don't fall asleep If she trippin' and she steady callin' me She callin' my phone and she buggin' me Yeah she trippin' Yeah I'm doing these shows I'm rockin' these shows and I can't come home She said she miss me, baby I'm overseas In the studio workin' with Yung Lean (I'm gonna sip it) And I'm smokin' weed Two bad bitches and they right with me It's me and Yung Lean, in the blood eighteen/bloody ting 4CG, KuKu Gang we overseas I'm sippin', over 100 degrees Posted with my boys, sippin' Hennessey I'm trippin' shawty down on her knee's Everything be okay I feelin' good in the breeze I get it lit man, You know we overseas Fly to Dubai, we'll be back in a week Feelin' like a hitman, you won't barely see me I'm gone in the wind, hiding in the streets I just popped a hydro pill I'm bout to lose my mind You be watchin' every step biting on my style Why you making music? man why you wasting time? Watchin' all my videos and biting all my rhymes Air Force 1’s so green look just like lime Thaiboy Goon just poured a four and we about to fly Runnin' round the airport with money on my line Yung Leandoer don't give a fuck about the fame I'm your girlfriends favourite rapper All these other boys they lame SBE, 4CG the team we switching lands like, switching lanes I had to go to rehab they claimed I was insane R-red roses in my bathtub, don’t give a fuck about the game bitch I'm sippin', over 100 degrees Posted with my boys, sippin' Hennessey I'm trippin' shawty down on her knee's Everything be okay I feelin' good in the breeze I get it lit man, You know we overseas Fly to Dubai, we'll be back in a week Feelin' like a hitman, you won't barely see me I'm gone in the wind, hiding in the streets I'm sippin', over 100 degrees Posted with my boys, sippin' Hennessey I'm trippin' shawty down on her knee's Everything be okay I feelin' good in the breeze I get it lit man, You know we overseas Fly to Dubai, we'll be back in a week Feelin' like a hitman, you won't barely see me I'm gone in the wind, hiding in the streets"
"39","Warlord"," god only knows "," Tell me you’re wild, wanna die, wanna uh God only knows what I might do God only knows what I might do I don't fuck with god I'm my own proof(SBE!) God only knows what I might do (Leandoer!) Take two of these feel like Goku (Like Goku!) Eyes Chinese when I roll through (Skrt, skrt, skrt!) Mixing medication up, no tofu I'm soul-less, my soul loose Take two of these feel I like Goku My eyes Chinese when I roll through When i fuck my soul loud, I need soul food I gotta run for my live I can't hold you If you want me to know, I can show you 6 inches on my sword, I feel like Kung-Fu (Ooh sleep, Ooh sleep, I don’t give a fuck, my pills look like scooby-doo) I don't give a fuck (SBE) I blow my mind up in pieces Wish I never lived in this secret Ay I'm me, I'm me, I'm free bitch Nothing ever comes for free bitch I can't even count to three bitch If you wanna tell me what the fuck to do I don't fuck with you How many times I gotta prove to myself what I do My gadgets they be water-proof I'm stuntin' on my Exes See me out in Texas Riding in the Lexus I call that ""Texas Reckless"" Candy coloured painted necklace on my face Flamingos rushing if you wanna take a chase I run fast bitch R-R-Run God only knows what I might do God only knows what I might do I don't fuck with god I'm my own proof Take two of these I feel like Goku Eyes Chinese when I roll through Mixing medication up, no tofu Where the fuck my soul? my soul lose 6 inches on my sword, I need like Kung-Fu Take two of these I feel like Goku I feel like Goku Like GG Allin, Don't be fucking up my fun Pink skies, fuck life bitch, you know I fuck I'm smoking purple snakes I'll never be done, got a stun gun Making songs like it's my last one Tryna get this cash you know it's coming son 61 sum never done, never done Chain made Swiss lace A bow and arrow when I come through Mirror antique I'm not looking like you I don't work for you I don't do nothing for you I do it for me-e-e-e, lil bitch! I'm smoking lavender Like Swiss caliper You know my burdies purr I got a pink fern On my girl you know I don't go with her Got pearls on my necklace I be stuntin' Lil bitch (I'm pretty as fuck)"
"40","Warlord"," how u like me now "," We rollin’ round, segway scooters Shooting Lasers, bring you down Gotta grind everyday, like get the fucking money now All these bitches tryna hold me down Demons in the wind, I'll be puffing on clouds We rollin’ round, segway scooters Shooting Lasers, bring you down Gotta grind everyday, like get the fucking money now All these bitches tryna hold me down No one on our level shawty How you like us now? How you like me now, shawty? How you like me now? How you like me now, shawty? How you like me now? How you like me now, shawty? How you like me now, now? How you like me now, shawty? How you like me now? I been rollin’ round, how you like me now? (Thaiboy) How you like me now, how you like me now? No one on my level how you like me now? With some work, count it like you’ve never heard With my money take you from the earth Watch me do, all I do is splurge Doing what I choose, all I do is splurge Yeah I’m still numbing nigga's earth Thaiboy, Thaiboy, swag, do all the work (all the work) Thaiboy, Thaiboy, cash doing all the earth (all the earth) Thaiboy, I don’t lie, still far from perfect How you like me now, shawty? How you like me now? How you like me now, shawty? How you like me now? How you like me now, shawty? How you like me now, now? How you like me now, shawty? How you like me now? How you like me now, shawty? How you like me now? How you like me now, shawty? How you like me now? How you like me now, shawty? How you like me now, now? How you like me now, shawty? How you like me now? I'm on top of the earth with Darth Vader snorting blow If you tell me do that, I'll probably say no Six blunted skeletons with me wherever I go It’s whatever, live forever So I pour it up slow I got the best of that shit, breaking bottles in the snow Euros, hundreds, hundreds, ice, diamonds, sipping Coke though Sixties, fifties, spend them so I can’t see no evil spirits Bitch I've been blessed How, how, how you like me now, shawty? How you like me now? How you like me now, shawty? How you like me now? How you like me now, shawty? How you like me now, now? How you like me now, shawty? How you like me now? How you like me now, shawty? How you like me now? How you like me now, shawty? How you like me now? How you like me now, shawty? How you like me now? How you like me now, shawty? How you like me now? How you like me now, shawty? How you like me now? How you like me now, shawty? How you like me now? How you like me now, shawty? How you like me now, now? How you like me now, shawty? How you like me now?"
"41","Warlord"," pearl fountain "," For my set, I go in So many places I don't know where I've been They keep asking me what state I’m in So many faces I don't know who I met (Ay, ay) Shining, shining foreign ice They be crying tears look like foreign ice She look scared, need that foreign ice Trapping out the Swedish snow, four nights (Ay, trap, trap) 30 days and 30 nights Dirty sad tears just like foreign ice Squirting liquid lean in that foreign ice Throwing fo's up yelling all aight In my Honda Countin' guap with Lean, slow Hoe's coming over Smoking on dro' (Ballin', Ballin', Ballin') Riding 'round on chrome Don't know what my partner on Neon lights all I see, I think I'm gone Ice blood on my face, I'm forever thrown SBE, we some vampires, Dracula I'm in an Acura, hoe I think you stack them up I'm not good with calculus, I need a calculator Glass elevator, shoes made by alligators I'm flying in the sky, feel the air I’m heartless, fire flying everywhere Let the darkness take my heart I put my heart on my sleeve I'm stuck forever I could never leave Saddest story ever told I don't fuck with you I'm always with my bros Twenty Thousand Sixteen, I need some gold All this money, all this money make me cold I said I cared, I really don't What you want? I'm always switchin' up my phones Where did I go? You'll never know Looking for me but I'm buried under snow For my set, I go in So many places I don't know where I've been They keep asking me what state I’m in So many faces I don't know who I met"
"42","Warlord"," stars align "," Stars align, shadows in the sky I bring the night alive, creepin' like a spy I'm swimmin' with the devil, I'm alone tonight I'm swimmin' with the devil, I'm alone tonight Stars align, shadows in the sky I bring the night alive, creepin' like a spy I'm swimmin' with the devil, I'm alone tonight I'm swimmin' with the devil, I'm alone tonight Border patrol, imported kilos of blow I'm in a Range Rover, sold out the shows I like my yellow like gold Hundreds my rolls, show up in 'dro Wherever I go they think that they know I'm with my bros, don't talk to po-po, Y-3 my toes I lost my soul, I pour up a four, I think I need more I think I need more, a friend from a foe, I make it snow When I'm alone, when I'm alone, leany gets sore, leany gets sore Life is a bore, I don't need no more, I don't need no more Superman captured, I go in, I go all out Tags on my jeans they all watchin when I walk out Yeah, I'm a dropout 'member when they used to doubt You know what I'm about, you know what I'm about Far in the distance, come close, make you scream and shout Far in the distance, come close, make you scream and shout Far in the distance, come close, make you scream and shout Swimmin' with the devil, I'm alone tonight Stars align, shadows in the sky I bring the night alive, creepin' like a spy I'm swimmin' with the devil, I'm alone tonight I'm swimmin' with the devil, I'm alone tonight Stars align, shadows in the sky I bring the night alive, creepin' like a spy I'm swimmin' with the devil, I'm alone tonight I'm swimmin' with the devil, I'm alone tonight Harmonizing Stars align, shadows in the sky I bring the night alive, creepin' like a spy I'm swimmin' with the devil, I'm alone tonight I'm swimmin' with the devil, I'm alone tonight"
"43","Warlord"," shine "," If I die Shine, all I do is outshine I can't go outside, I do this for my life Fluorescent lights, I need a bitch by my side All my brothers gone' rise All I do is outshine Blood blood on the moonlight Let me live I'm alive No feelings left in the night White powders sprinkle my sprite I stay up and I work all night I flipped a couple of cows You know I don't play both sides Let me come inside No moon only a space station I felt my face melt I left my chain stealth I'm just like Rainman My money raining I'm feeling sacred Diamonds my bracelet Shawty needs face lift You know I'd take it Would always chase it My heart could never break it My cuffs kept breaking I'm not even gonna say shit I don't like conversations I feel my face melt No moon only a space station Lend me a light Shine, all I do is outshine I can't go outside, I do this for my life Fluorescent lights, I need a bitch by my side All my brothers gone' rise, gone' rise, gone' rise Let me in I'm alive Let me in I'm alive All my brothers gone rise The feelings left in the night in the night in the night oh oh I'll try All I do is outshine You know I can't go outside I do this for my life my life my life I see fluorescent lights I need a bitch by my side All my brothers gone rise Blood on the moonlight Let me in I'm alive Let me in I'm alive Let me in I'm alive You know I can't go outside outside outside I'll promise I'll try I need a bitch by my side Know what I do is shine I do this for my life my life my life"
"44","Frost God "," back at it "," I'm back at it Yeah, I'm back at it In a Range Rover Givenchy backpacking With two crack addicts Yeah they back at it In the club, jetski Throw it back a bit I'm back at it Yeah, I'm back at it In a Range Rover Givenchy backpacking With two crack addicts Yeah they back at it In the club, jetski Throw it back a bit I'm Darth Vader and this shit get your head up Need more coke, need more pills, need my bread up I'm the spider on your skin, you a bedbug Always talking all this shit but you're a big bluff Trying to get rich in my town, you can text us Yoshi City, never learn with you I'm fed up She go down so deep down, get her head stuck Baby girl I'm with you, I can switch up I'm with my bros, hell yeah, they my big ones I'm the youngest in this shit but I got big bucks I'm back at it Yeah, I'm back at it In a Range Rover Givenchy backpacking With two crack addicts Yeah they back at it In the club, jetski Throw it back a bit I'm back at it Yeah, I'm back at it In a Range Rover Givenchy backpacking With two crack addicts Yeah they back at it In the club, jetski Throw it back a bit"
