"","Album","Song","Lyrics"
"115","JEFFERY"," floyd mayweather "," Ayy, ayy This real talk type shit, swear to God We just gon' call this shit drip, you know I'm sayin'? Ayy, ayy Little bitch, you ridin' niggas' dick like a bitch, damn Little bitch, you ridin' niggas' dick like a bitch I got, six brand new foreigns on my wrist (on my wrist) I got six Forgiatos on my fist (on my fist) I got fifty foreign hoes on my dick (yah, yah, yah, yah) I'ma nut in all 'em hoes, let's have some chicks (ooh) Nigga tried to hit a lick and missed (blat!) Tried to run then I caught him like a fish (caught his ass) I'ma catch his ass with the whole clip (blat! blat!) I'ma beat they ass up like Ron Artest (mwah!) Pussy nigga ran like a Miss (hah!) I got your bitch up underwater tryna kiss (mwah! mwah!) I'ma gon' and shit and take a piss (mwah, mwah) We done fucked her legs and fucked her face Cash out on the whip I don't want no rent VVS hit off that G Star V-neck (yeah-yeah) Chop the top off that Stringray Corvette (yeah) Two bitches with me, they on molly, they on X (yeah) Took my foreign to the club, pulled in a vip (yeah) Took some ho to the hotel and made 'em strip (yeah) She sucked me loose I had to give that bitch a tip (yeah-yeah) Everybody smashed that ho, that bitch the rip (yeah-yeah) I'm sellin' purple rain, RIP to Prince When I was behind the fence they treated me like a prince So much jewelry on, her pussy gettin' tense 1017's the ones you don't wanna diss And you can never be like 'Wop you little snitch You make me mad, I have a threesome with your bitch I'm from Custer East Atlanta, yeah the 6 I make one brick turn to two, I know a trick The walking lick, my chopper is my walkin' stick Everybody got they passport ready to dip, Europe UK 25,000 dollars on a trip I just-I just found out rats can use they lips (yeah) I got, I got, I got me a thirty round clip I got one in the head, thirty one rounds on my hip (yeah) Aye, okay, Lil Dora said I was born with a skill My lawyer say it's guaranteed when he appeal (yeah) I got a bad bitch wit' me and yeah she strip Shake it, I tip I sip, I dip (it's lit) Grip, I drip I killed, I All I eat is lean no lie and pills (oh my God) Put that, put that in my girl (straight up) Makin' porno videos and takin' stills Turn that, turn that to a film (drip) Yeah anywhere we go (yeah) I bring the snow I fill your nose (straight up) Ether, howdy my mamacita Stay away Lucifer, she sexy in that all white beater (yeah) Dynamite no whine up Have you fly from India, have you fly from China I won't feel you honestly, strap up 49er Pew-pew-pew, pew-pew-pew I'm in Vegas spendin' thousands on my chips I can't love these bitches, fell in love the rip I was doin' this shit just for my peers I would put inside my blood, my sweat, my tears Do this shit all on my own, don't need no deal Diamonds flawless 'round my neck, gave me a chill Lately I've been flyin' on them Lears Flyin' cross the world, these bitches killin' me Flood her bank account with bands cause she feelin' me Nigga cash on delivery If it's a snake on my clothes then it's double G I don't like police hoes, ain't no cuffin' me All my diamonds dancin' like they Bruce Lee Check out my smile I got some new teeth Pop a molly now I'm in the fuckin' air Cloud nine and I'm smokin' like the fuckin' bear We at the Clearport, you niggas never there I wouldn’t even cap lil bitch this our year I do it for my fam, 20 racks on gifts Bitch we blowin' gas, roll me up a spliff Now what you think a young nigga grindin' for? I sip it till I sleep, I might overdose She made it out the hood and left that dope bowl Get them bricks from my momma, she got truck loads Fuck you mean you get it from your mammy hoe? Yeah Diamonds all on my chin, diamonds all on my folk Piercin' in my nose, diamond in my nose Giuseppe open toes, diamonds on my toes I just got a family pack of Jimmy Choos, damn I just bought a chopper and I'm ready to use it, damn I got a lot of bitches comin' by the twos I got a lot of bitches, bomin' by the few Big di-diamonds but we call 'em jewels All these racks think I sell dog foods I spend thousand on my fuckin' shoes Pull up in this Ave, it cost the Christian Loubes Nigga watch your mouth, we ain't fuckin' cool YSL the mafia, that's a fuckin' fool Take this shit out and shoot"
"116","JEFFERY"," swizz beatz "," L-O-V-E For life Love Love, love, love, love Love, love, love, love Love, love, love, love Love, love, love, love Gotta ride for your team Nigga play you busting And I got me a high self esteem Love, love, love, love Love, love, love, love Love, love, love, love Love, love, love, love Love Love, love, love Big old digits with me Big old Bentley with me Big old bitches with me S gang chino with me with me I got 3 stripes, Adidas with me, with me All of my creatures with me, with me I got some features with me, with me Big racks and that Aether with me, with me (racks) Tote that like it's legal woody, woody I look that shit up 'bout a thousand times This bitch Master P cause she 'bout it, 'bout it That boy got cheap rims on a cheap Jeep Just make sure you tell him his hoe a freak I’m sitting at the top of the nose bleeds And I got my gold off of Goldie Work it, twerk it baby, you have to hold me, wait for home Wake up to Young Thug Have you ever been a shot caller? (Have you ever?) Proceed to the room, leave em stalkin' Love Love, love, love, love Love, love, love, love Love, love, love, love Love, love, love, love Gotta ride for your team Nigga play you busting And I got me a high self esteem Love, love, love, love Love, love, love, love Love, love, love, love Love, love, love, love Love Love, love, love SOB, SOB, SOB That's on me, that's on me That's on me, that's on me Bands on me, bands on me Turn up for the girls Turn up for the boys Turn up for the club Turn up on the drugs Turn up on the molly Turn up on the Xan Turn up on a perky, give it to my man Here, give it to your clan I put on my mink I'm like a lamb Stop trying to impress these fuckin' cams I'm comin' for mine, Uncle Sam I'm turnin' money into power We not from here we need a browser You just squirt, squirt I know you don't want none, coward I'm studyin' like a bookworm I'm tryna count at least a hundred bands (racks) And I wanna just buy some bigger land, yeah Love Love, love, love, love Love, love, love, love Love, love, love, love Love, love, love, love Gotta ride for your team Nigga play you busting And I got me a high self esteem Love, love, love, love Love, love, love, love Love, love, love, love Love, love, love, love Love Love, love, love"
"117","JEFFERY"," future swag "," Thugga Yeah it's that cash talk Slatt Slatt Slatt I fuck on your baby mama I fuck on your baby mama Let's fuck on your baby mama Cause I wanna fuck on your baby mama Some head from your baby mama I need some brain from your baby mama The head from your baby mama I need me some brain from your baby mama Lil mama she wet like a boat, a boat Lil mama, she wet like a boat Lil mama she wet like a boat, a boat Lil mama, she wet like a boat Lil mama, she ready for war She ready for dick in her ass and her throat Lil mama she wet for the faculty Lil mama, she ready, she after me Gon' do it, gon' do it Gon' do it, they way too influenced I do it, I do it, I'm the goat I'm the motherfuckin' mule I do it, I don't know the president but I got pull I do it, the only thing I see is red like a bull That purple label all up under my garments They tourin', I fuck on that bitch in the back of the tour I feed her that molly she put it right there on her tongue You call me Osama I'm passin' hundreds to the bombs I'm passin' hundreds to the bum nigga You know thats nothin' but some crumbs nigga The finger lickin' and my palms itchin' I'm dead fresh, fuck a prom nigga I'm on yo' ass like some thongs, nigga I'm brand new just born, nigga I'm gettin' hundreds like a foreign nigga You know we chargin' like Dodge nigga I fuck on your baby mama I fuck on your baby mama Let's fuck on your baby mama Cause I wanna fuck on your baby mama Some head from your baby mama I need some brain from your baby mama The head from your baby momma I need me some brain from your baby mama Lil mama she wet like a boat, a boat Lil mama, she wet like a boat Lil mama she wet like a boat, a boat Lil mama, she wet like a boat Lil mama, she ready for war She ready for dick in her ass and her throat Lil mama she work for the faculty Lil mama, she ready, she after me I won't hear you scream if you rich I'm never gon' go out like Meech I know that I look like a lick I chop off your tongue, ya dig A solid foundation the nation Believe this shit started in the basement My uncle that died is amazing You see all the looks on my faces I see all them racks on ya' cases We send them to a better place We send them boys to meet their maker I'm goin' up skyscraper I think my dogs with my neighbors Your kids seen me on cable, and I'm drinkin' syrup, nigga maple (lean) Hurry up where the gates at She ain't nothin' I can't cake that This is only where the apes at All you lame niggas stay back (move) Switchin' lanes in the Maybach (skrt) Hit the motor like a play back Brand new Rollie and the face black I fuck on your baby mama I fuck on your baby mama Let's fuck on your baby mama Cause I wanna fuck on your baby mama Some head from your baby mama I need some brain from your baby mama The head from your baby mama I need me some brain from your baby mama Lil mama she wet like a boat, a boat Lil mama, she wet like a boat Lil mama she wet like a boat, a boat Lil mama, she wet like a boat Lil mama, she ready for war She ready for dick in her ass and her throat Lil mama she work for the faculty Lil mama, she ready, she after me"
"118","JEFFERY"," riri "," So I just came out the booth to God damn, to hear this, to hear this shit right here. And my niggas, nigga just, nigga just said, ""bruh I just told them the same shit"". That nigga say he just told these girls that, he knew what I was 'bout to say. That's crazy, cray-cray, I dig though, you know what I'm sayin'? With a golden shovel, with a iced out AP, plus a Rollie bezel on another level I say bitch what is you thinkin', we Arthur Blankin’ Big checks on me and I got ranking, I'm steady ranking Better stop listenin' to these hoes 'fore you start shrinkin' I know I'm a blood, I'm a gang banger I know ain't a bitch but I'm still singin' Mothafuck the rest, they ain’t really bangin' I got the real hitters with me and they dangerous You can't find 'em on no camera but they no namin' Wash 'n powder bae I’m tired, I’ve been up all night Me and bae Bonnie Clyde, everything we do right Love her vibe, love her vibe, she make me feel so nice She 100, the first day we met, she let me fuck all night Ah-ah-ah-ah-ah-ah, work Do the work, baby, do the work Tonight, baby, do the work, baby, do the work Tonight I wanna chill so you gotta do the work (Rihanna) If you want it, you gotta earn it You gotta earn it, you gotta earn-earn-earn-earn-earn-earn it If you want it bae you gotta earn it Alright, earn-earn-earn-earn-earn-earn it, aye I can tell that you want it baby, I can tell that you need it I can tell that you suckin', fuckin', I can tell you a demon I can tell you a Victoria, baby, I can keep your secret I'ma show you how to win without cheatin', I'ma show you how to beat it Drop top in a hotbox with a big tall demon I'ma let you defeat me, I'ma lead you to victory Like, shoutout to Stevie, but these niggas not seein' me I'm a big dinosaur, B, and these niggas not bein' me Aye, I'm scared to trust you, I'm scared you'll trick me I done drive by in a armored car but they're still trynna hit me Put 60,000 on my mama ring and it ain't even come out of Tiffany's I can tell you how to get the money but you just gotta listen to me Ah-ah-ah-ah-ah-ah, work Do the work, baby, do the work Tonight, baby, do the work, baby, do the work Tonight I wanna chill so you gotta do the work (Rihanna) If you want it, you gotta earn it You gotta earn it, you gotta earn-earn-earn-earn-earn-earn it If you want it bae you gotta earn it Alright, earn-earn-earn-earn-earn-earn it, aye I picked my diamonds out a honey tree I done made a couple millions off of BET I got gangster bitch that ride and they gon' clap for me I just signed a deal with Kevin, baby clap for me Kevin without hundreds on me Jeep truck when I pull up on 'em Peep that with my little homies I see all these little clonies (who?) I see you lookin' homie Apple Watch with them boogers on it Turn you down, upside, right baby girl like I'm cookin' on ya I got 70,000 for my last 30 shows (do the math) I done spend a half a million for my family though I think it's time to take my homies thes ride on a boat Show them a good time cause I know they’ll do that for me, oh Ah-ah-ah-ah-ah-ah, work Tonight baby, gotta work, work, work, work (aye) Work, work, work, work (aye) You gotta work, work, work, work, you gotta work (aye) If you want it bae, you gotta earn it You gotta earn-earn-earn-earn-earn-earn-earn it-aye If you wanna earn it Yeah, you gotta earn-earn-earn-earn-earn-earn-earnit, aye Build a bridge, you better not burn it, aye Better be the number one concerned one, aye I got big dogs and they German, aye Aye, aye, aye, aye"
"119","JEFFERY"," guwop "," I done put 20 up under the Sig... Ya dig, ya dig Ya dig I done put 20 inside the Sig (ya dig) I pull up on you and I pop at your kid (ya dig) I pull up to your block and I pop at your wig (ya dig) I hopped out the Coupe and I'm fresh as a bitch (ya dig, ya dig, ya dig) Since I was a youngin', I been gettin' dough (ya dig, ya dig) I count my backend and I turn up the show (ya dig, ya dig) I want hella Xans, they get me off (ya dig, ya dig) I put the V neck on my team, yeah (ya dig, ya dig) I dig everything that you sayin' I dig everything that you doin', too I dig the way that you look at me You dig the way that I look at you I just wanna grab on your butt, but The seat in the Benz, the Chanel Clutch The FN, it give him a haircut I roll up a seven of John Dutch That big booty bounce on the dick and it broke I don't gotta act like a gangsta and she know, dope My Backwood look like a pole, yeah My Backwood look like a pole I sit on clouds of the smoke I'mma blow pounds of the smoke Pardon me, pardon my soul I crack a smile for them folks Niggas they eatin' in broad day In that hoe mouth like a Colgate Keepin' that cold case, God, please give me that cold case Man, I don't want no new friends, forgive me for all of my sins I don’t wanna think about losin', all I wanna do is win win I done put 20 inside the Sig (ya dig) I pull up on you and I pop at your kid (ya dig) I pull up to your block and I pop at your wig (ya dig) I hopped out the Coupe and I'm fresh as a bitch (ya dig, ya dig, ya dig) Since I was a youngin', I been gettin' dough (ya dig, ya dig) I count my backend and I turn up the show (ya dig, ya dig) I want hella Xans, they get me off (ya dig, ya dig) I put the V neck on my team, yeah (ya dig, ya dig) Without the radio, it's 20 a show and that's fo' sho' Get that back-end, bitch, we buyin' dope, that’s how it go Black Amigos, bout the Freebandz That 44., I could cook the dope with no stove Pot on the floor Pull up in that coupe shit, nigga like damn, where the roof went? In the streets, they call me Jay Z, lil bitch, I got the blueprint No nigga, I don't want no old hunnids, you know I want them blue strips And I can't fuck you old hoes, I'm ballin' with my new bitch, yeah You dig that? 200,000 worth of chain and that's a fact Got my name in this rap game by sellin' crack Rest in peace to OG Double D, you dig that, slime! I done put 20 inside the Sig (ya dig) I pull up on you and I pop at your kid (ya dig) I pull up to your block and I pop at your wig (ya dig) I hopped out the Coupe and I'm fresh as a bitch (ya dig, ya dig, ya dig) Since I was a youngin' I been gettin' dough (ya dig, ya dig) I count my backend and I turn up the show (ya dig, ya dig) I want hella Xans, they get me off (ya dig, ya dig) I put the V neck on my team, yeah (ya dig, ya dig) (Quavo) Shoot out the coupe (pew-pew) Shoot out the roof (shoot out the roof) Pull up and smash on her We don't got to put a bag on her I took your ho, ya dig? (ya dig?) I told her hold the Sig (sig) Had big bales, midget (big bales) Now you can't say I ain't got millions (ay!) Swam with the sharks, water (splash) You be law and order (12) I be gettin' money every mornin': Tom Joyner (uh) I heard you gettin' money But you payin' em niggas extortin' ya (dig?) You pay for your fame and fortune (huh) You pay for your fame and fortune I am the plug, cordless (brr) Pull up with blazers, Portland (brr) I pay the neighbors (cash) To pick up the dope on they porches (dope, uh) I came from nickels, I came from Nichols My niggas don't know you, we do not fuck with you I've been in the system, I've been in a pickle You dig me like shovels, I gotta fuck with ya I done put 20 inside the Sig (ya dig) I pull up on you and I pop at your kid (ya dig) I pull up to your block and I pop at your wig (ya dig) I hopped out the Coupe and I'm fresh as a bitch (ya dig, ya dig, ya dig) Since I was a youngin', I been gettin' dough (ya dig, ya dig) I count my backend and I turn up the show (ya dig, ya dig) I want hella Xans, they get me off (ya dig, ya dig) I put the V neck on my team, yeah (ya dig, ya dig) (Offset) Hop in the private (private) This is a Lambo, not a hybrid (skrr) My wrist is a faucet (watch) Feed 'em perkies, I'm the doctor (doctor) Draco, 100 round choppa She got her eyes on me like binoculars (watch!) Count up this money, it's marvelous (count it up) Stall the bitch, I don't call the bitch (stallin') You better dig what I'm sayin' (dig what I'm) I'ma kill you and your mans (I'ma kill) Beat down the block like an amp Goin' up like a skateboard on a ramp (woah) Go buy the Rollie and bust it (bust it, bust it) Talkin' that tough shit But you know you not gon' bust shit (huh, huh) Look at my fashion This is a Gucci rugby (look at it, look at it) I'm trappin' and rappin' Still got 'em babies in custody My diamonds be dancin' Live in a mansion My life is lovely (My life is lovely) Ain't no more loyalty Knock your ass off, pay the lawyer fee (Pow, pow, pow) Shit can get ugly I done put 20 inside the Sig (ya dig) I pull up on you and I pop at your kid (ya dig) I pull up to your block and I pop at your wig (ya dig) I hopped out the Coupe and I'm fresh as a bitch (ya dig, ya dig, ya dig) Since I was a youngin', I been gettin' dough (ya dig, ya dig) I count my backend and I turn up the show (ya dig, ya dig) I want hella Xans, they get me off (ya dig, ya dig) I put the V neck on my team, yeah (ya dig, ya dig) (ya dig, ya dig, ya dig)"
"120","JEFFERY"," harambe "," Mafia! Billboard Hitmakers Yeah, AP gang bitch, you know what I'm sayin'? Level up! Yeah Yeah AP gang Catch him down bad Beat him with a bat, hashtag that (yeah) I call it New Jack, yeah, yeah Bitch, I got a blue Jag (yeah) I make that cash talk nigga I got a new house You wanna get in, need a passcode nigga 225 on the dashboard, nigga Stack it up and then you get that foreign nigga Step it up and take care your daughter nigga Stack it up and take care your son nigga Step it up and take care that money You know I ran it all up by myself And now your bitch is drinking cum, nigga My diamonds yellow like a corn, nigga Double R at the prom nigga Skrrt, skrrt skrrt Got some hitters all of 'em my cuz nigga Girl, I know you love me Love me, I know, I know, I know you love me You love me Hey! Bentley wheelin' nigga, bad killer nigga, back it up Bands kill a nigga fast, will a nigga back it up? Ape shit nigga, Godzilla, nigga, act up Go ape shit, go Godzilla, bae, back it up I just wanna have sex I just wanna have a baby out you, girl (hey) I just wanna go brazy about you, girl (hey) Don't make a nigga act crazy, oh-ooh girl (ayy) Cause you know I will And I'm on a perky pill This shit can get ugly for you I'll pull up and bust your mama I'll pull up and bust your brother I'll aim at your fuckin' family (brrrat) I'll aim at your whole clique (brrrat) I'll aim at your mothafuckin' mama I'll aim at your fuckin' dad (brrrat) I'll aim at your daughter, son, nigga (what?) I'll aim it at everything I'll aim at the baby I got devil inside of me (hey) Got the devil inside me (what?) God tryna provide me (God) God tryna decide (what?) Do he wanna leave me or sign me? (Who that?) Um okay I know you're frustrated 'bout a nigga And everything I take you through (Pablo shit) I know I did a lot of sins I hope you still let me make it through Just cause I got me a spot in LA That don't mean I'ma change the crew My bitch trying to figure out How she can tell me to chill without changin' you Fuck it, I'm changin' up on 'em But my fans, not changin' on 'em Makin' a band, I'm sangin' on 'em Whip out that bag, syringin' on 'em Hey, hey we locked that bitch out with no passcode I bought her some of those Damn, she already had 'em though Bentley wheelin' nigga, bear killer nigga, back it up Bands kill a nigga fast, will a nigga back it up? Ape shit nigga, Godzilla, nigga, act up Go ape shit, go Godzilla, bae, back it up I just wanna have sex I just wanna have a baby out you, girl I just wanna go brazy about you, girl Don't make a nigga act crazy, oh-ooh girl Cause you know I will And I'm on a perky pill"
"121","JEFFERY"," webbie "," Thugger! I roll me one, smoke to the face I roll me one, smoke to the face Roll up a blunt and I'ma face it King Slime, hey! They politickin' 'bout these cases ('bout these cases, hey, ooh-ayy) I told her roll me up a blunt and I'ma face it (and I'ma face it, hey!) Troublemaker man I've been shootin' out with my neighbors, yeah (yeah) My lil' niggas been tryna trap it out in the vacant, yeah (yeah) Patek Philippe, they got my wrist and they don't play with that (Patek Phillipe) She been suckin' dick way before a nigga made it, yeah Pass me the mothafuckin' lighter (pass, pass) Lil mama overseas, I'ma Skype her (thugga, thugga) Nigga checkin' out the squad, tryna bite us (slime!) But my hand is way different got the Midas (woo!) Do a dream with me, ayy do some things with me (yeah) Bae drink your lean with me, bae fall asleep with me (yeah) Ayy fall asleep, we drive (woo) Jeopardize your life or mines Let me fuck one more time And I'll help you write your rhymes It's extremely fake They politickin' 'bout these cases (hey, ooh-ayy) I told her roll me up a blunt and I'ma face it (hey!) Troublemaker man I've been shootin' out with my neighbors, yeah (oh yeah!) My lil' niggas tryna trap it out in the vacant, yeah (brr!) Patek Phillipe they got my wrist and they don't play with that (Patek Phillipe) She been suckin' dick way before a nigga made it, yeah (yeah) Band, band, bands Right outta the plans, plans, plans I'll pop at your man, man, man I'll do what I can, on a Xan Guess I'm geeked up like an astronaut, I'm off the Earth I'm way in the moon, kickin' shit without a broom My mama can't lose I'ma keep her in a fresh car and I'm good on them shoes I'ma keep her so froze up, yeah I'ma keep her in some jewels I'ma go'on 'head and nut in my bitch I'ma gon' and give her juice She did two times now, I done told her that was rude They don't wanna see you win Nah they want you always to lose They gon' always want you be stuck with them They'll never wish you good luck on them And they'll never wish bad luck either And I don't know what the fuck to think either Got a foreign car like a white beatle Actin' like she like people Knowin' they don't give two fucks if they're still here They'll leave her This politician is so fake They politickin' 'bout these cases (put it on God, hey, ooh-ayy) I told her roll me up a blunt and I'ma face it (I know he listen, hey!) Troublemaker man I've been shootin' out with my neighbors, yeah My lil niggas been tryna trap it out in the vacant, yeah (oh yeah) Patek Phillipe they got my wrist and they don't play with that (Patek Phillipe) She been suckin' dick way before a nigga made it, yeah Got off my ass and I got tired of waitin' Mama say, ""You gonna make it, you gotta be patient"" Came out the hood, trap out the stove out that vacant Now we flyin' different places, fuckin' bitches all different races I did this shit that they thought I wouldn't do and I made it I was so down bad and so fucked up, couldn't make over 80 I lost some friends, that was so fucked up And I know that they hate me (fuck, fuck) Thugger, he gave me a chance and I had to take it (gimme that) Used to chop on the block with the 380 Now when I pull up they gotta pay me I came from nothing, born in the 80s These niggas actors like Patrick Swayze I gotta get it, I can't be lazy Didn't have a dime so my mama crazy Ran up a sack with Thugger, baby Man this shit so amazing Patek Phillipe Cost a hundred bands, man Clear nothing' on it Then I went and seen Elliott and iced that mothafucka out, you dig That's on Big Duck, that's on all 6, know I'm sayin'? I got like a 170, 180 thousand dollar watch, bro And it glow up green at night And when the sun hit it on the plane You understand what I'm sayin'? Yeah, I used to do this shit to maintain Til I started usin' 14% of my brain And that left me with 5 stars worth of stains, you dig? Thugger!"
