"","Album","Song","Lyrics"
"74","Slime Season"," wanna be me "," Please tell 'em they wanna be me Somebody tell 'em they won't be me Tell lil mama she wanna be me I pulled up through, they wanna be I tried to tell them they won't be me, nigga I tell them they won't be me (Tell them, tell them nigga) City know, city know they can't be me (the whole city) City know, city know they can't be me Know they can't... (I swear, I swear, I swear) I could be servin' to be precise Oh, she cook the Thugger corn and rice I fuck her fast, within the night I might pour a lot of pints, a lot of Sprite, a lot of ice Two cups stuffed, I need two cups stuffed Ran them bands up, bitch I'm eating I'm getting bucks Clean a bitch face with the nut, fuck a Puff Young Thugger savage, Thugger savage, Thugger savage I'm a savage, I'mma fuck her like a savage She love my thing and then she following all my steps Then she chase a nigga down like a rabbit I’m stupid flooded with them karats I got some motherloving karats I'm a karat I paid 150 for the karats in my chains and my rings Watches is just change, yeah my ice from Johnny Dang No comparing you plain I got mine ice from Avianne Even if you a lame, you bool if you stay in ya lane You can feel my pain, and I dont need no T-Pain You got so much pain that you don't need no T-Pain Thugger Thugger pain they ain't gon play with, no way I'm gon' bust his brain and mail his ass straight outta state I'mma pull up right in front of your land and take ya pint I'mma pull up on you, point a beam ready to bake I'mma pull up tryna thug for racks and chase them drinks I can't find the place, I'm pouring your children down the sink Loud, loud talk Bitch I'm a motherfucking savage I'm a savage, I'm a savage, I'ma motherfucking savage She see them niggas beat her down, wanna fuck the bitch She fuck with Thugger Thugger like a karat My Maison's on her like a carriage My wheels taller than a Ferris Came for the karats I'mma show her love and she gon fuck me like a king I'mma fuck her friend that says she fucked me in her dream I'mma make her nut and yes I want that nut on me I'mma fuck them both and yes, they want that nut on we Cut that bitch on tour depending on record, D.I.E I'mma catch your bitches, yes she fucking on my team I'mma catch your mama, she gon' fuck me and my team I'mma catch them both and they gone I'mma catch your bitches sick Bet she wanna fuck a nigga, for real Bet she wanna fuck a nigga, for real Woo I ain't gon stop I'mma fuck em, I'mma fuck em forever I ain't got stop I'mma give 'em, throw up all the cheddar I'mma catch on these bitches, spray a bitch with the Beretta I would fuck on her sister she got her groove back like Stella Oh my god Oh god Karat Karats in my watches, in my jewelry, in my chain Karats on my flosses, twelve-hundred on my thing Coming in their mouth and never coming out the south I'mma fuck that bitch and then I nutted in her clit Know a couple bitches, she wanna fuck me in the kitchen"
"75","Slime Season 2"," big racks "," Yeah No I'm not Jordan but I am the GOAT Diamonds they wet like a boat Diamonds they wet like a boat Diamonds they wet like a boat No I'm not Jordan but I am the GOAT Diamonds they wet like a boat Diamonds they wet like a boat Diamonds they wet like a boat I got some big racks right on me I got some big racks right on me I got some big racks right on me I got some big racks right on me I keep them big racks right on me I got them big racks right on me I sat them big racks right on me I got them big racks right on me Big racks right on me, I keep them big racks right on me Skinnies right on me, still got them big racks right on me I got them big racks right on me, I got them big racks right on me I got them big racks right on me, I got them big racks right on me I keep some big racks right on me I keep some gnats right on me I keep that pack right up on me I keep that gat right up on me Pussy nigga back it up Chi-raq shoot like me in court Hit me one time in my stomach Purple leaking out my gut Fuck your bitch I don't give a fuck We get stoned till we throw up I'm living life like the Jefferson's Bible scriptures on my chest and shit My pockets swole Nutty Professor it If it came 'cross my table, we dealt with it I need me at least 2 like I'm stepping it I'm so bool that these bitches are acceptin' it I got bitches that been known the bando I’ll show niggas that’s with it no blindfold We the monsters, we slime, we not kind folk We so cool with the dope, we want molto I know reds I know blues but no popo I want ice in my teeth but no Coco When I fuck her I perform the yoko I pull up with gang members not solo I got some big racks right on me I got some big racks right on me I got some big racks right on me I got some big racks right on me I keep them big racks right on me I got them big racks right on me I sat them big racks right on me I got them big racks right on me Big racks right on me, I keep them big racks right on me Skinnies right on me, still got them big racks right on me I got them big racks right on me, I got them big racks right on me I got them big racks right on me, I got them big racks right on me YSL Hercules, Hercules I hide my dope and my coke in trees Stickin' your bitch like a porky-p I rock that white while she snort a G Finger lickin' nigga, quarter key Your money small I call it shorter G's She up and down on it repeatedly I fuck her hard, don’t accept apologies Baby gurgle, color purple Dick need nursing, gotta burp her 40 pistols, niggas lurkin' Top Shotta, kill my nigga Never heard of, get to murkin' Closed curtains, no outbursting We real killers not no crowd bursters Psyche, bitch I'm shootin' every person Catalyst, catch the wrist Rabbit shit, fuck your mix I’m the shit, she the shit 40,000 she’s a Birkin bitch Looking, smelling, talking, walking bricks Acapella still I walk the shit Moonrock come from Cali, coughing, shit R.I.P to Paul Walker, shit I got some big racks right on me I got some big racks right on me I got some big racks right on me I got some big racks right on me I keep them big racks right on me I got them big racks right on me I sat them big racks right on me I got them big racks right on me Big racks right on me, I keep them big racks right on me Skinnies right on me, still got them big racks right on me I got them big racks right on me, I got them big racks right on me I got them big racks right on me, I got them big racks right on me"
"76","Slime Season 2"," thief in the night "," Just like a G, you know? Trouble, Trouble, what's popping, 5? B4, let's do it Yeeeee! I wake up and go get me some new money You know I'm living like a G These lil niggas ain't gonna take nothin' from me You know we do it like a G I swear to God I fuck on anyone Just like a gangsta, just like a G This Duct Tape and YSL You know I do it like a G G's up hoes down G's up hoes down G's up hoes down G's up hoes down G's up hoes down G's up hoes down G's up hoes down G's up hoes down Like a thief in the night I take anything but some pussy She got that head like a dyke She got that head that I like Deep in your partner ain't right Put that lil babe on ice I make the paper like rice Head on that bucket, your mothafuckin' life, Skoob I promise you don't know me I pull up bout my cake Where I'm from is not safe I got fish, I'm a lake Scoop them grits on a plate Yet she thought it was steak I'm a thief in the night Make her ride like a bike I go down on a dyke, I go up on my price I might drop Kimbo Slice, kidnap like Uncle Ice I got grits at the beach and they white like a rice Let Trouble take your life After I give you five Straight put that five to the side It ain't no question how nigga gon' ride When they come with them questions My nigga get quiet, sh sh, nigga sit quiet, sh sh I am not taking no disrespect You Patrick Ewing, you pump fakin' No that won't happen on me I drop a key like the mufuckin' beat I look good as your dad on a Friday So many cars I gotta buy a driveway Never gon' let 'em live a nigga crime day Serving these X and P's instead of poppin' Pockets fat up like they jumped 'em YSL, that slimy anaconda Bicking back, being bool like a uncle I'm so geeked up I might fuck a condom Like a thief in the night I take anything but some pussy She got that head like a dyke She got that head that I like Deep in your partner ain't right Put that lil babe on ice I make the paper like Rice Head on that bucket, your mothafuckin' life, Skoob I promise you don't know me I pull up bout my cake Where I'm from is not safe I got fish, I'm a lake Scoop them grits on a plate Yet she thought it was steak I'm a thief in the night Make her ride like a bike I get 'em all on the rice She didn't even know what it was but she taste it I dig in, her shit sound like Jason I be on Percocets more than occasion They betting on me like in Vegas Betting on me like I'm Vegas Stick to the code man, there won't be no trace Thugga Thugga, tell me what would you say? What would you say? No J Money, but my gun say, ""Bow"" Pop a molly, look at her then fiend I'm the target mofucka, no beam No this shit is not good as it seems I might give her the boot with no jeans I kick shit like a chong and a ching I’m a boss, I'm bout that unity Sandwiches, you know you in between And you gotta know we at the green You gotta be young nigga, wilder than Billie Jean Gotta have paper for lawyer fees You ain't with it, you a L Still getting it, yeah, bails Break it down on the scale If it add up, hell yeah, I do it Lap back as he ran to it Like a thief in the night I take anything but some pussy She got that head like a dyke She got that head that I like Deep in your partner ain't right Put that lil babe on ice I make the paper like Rice Head on that bucket, your mothafuckin' life, Skoob I promise you don't know me I pull up bout my cake Where I'm from is not safe I got fish, I'm a lake Scoop them grits on a plate Yet she thought it was steak I'm a thief in the night Make her ride like a bike"
"77","Slime Season 2"," don t know "," My newest bitch say that she got it, ya digg? Show me your mill, I put my sig in, ya digg? I want that pussy, cause it's as tight as a kick Look at my rollie, it's as cool as a fridge Push your top back cause I feel like it a wig I don't know why, I don't why, but I did I don't know why, I don't why, yeah But can you hurry up and buy, yeah Graduated from Howard I'm the shit no bowel Beat it up for an hour, she's wet as a shower Hoppin' out on them cowards with nothing but 'em whoppers I'm a level 5 goblin 30 deep, all them lil niggas be mobbin' Have you ever seen a street geek barbarian R-I-P Monroe no Marilyn Give my mama everythin' nigga, evident Aye, I ain't goin' steady, but I'm ready Let 'em bitches hit just like your necklace We got blocks and we treacherous Take your necklace, you neckless Please stay outta my section, yeah Pullin' out that choppa that moment that nigga get her, yeaah My newest bitch say that she got it, ya dig? Show me your mail, I put my stick in, ya dig? I want that pussy, cause it's as tight as a kick Look at my rollie, it's as cold as a fridge Push your top back cause I feel like it a wig I don't know why, I don't why, but I did I don't know why, I don't why, yeah But can you hurry up and buy, yeah God, got this gas, blowin' so hard Call a nigga shrimp, that's a po'boy Thy gon' make us let the windows down on a Rolls Royce Hustle hard, I keep that 44., got a dick Bitches get round me they sneezin', jewelry game sick I love mud, I done poured the deuce up so slick Hop up in my car, now lick and go sit on the stick Put the marker on 'em niggas and see if they real I'm out in Texas, buyin' pint, keep this shit trill I got ashes droppin' on the Bentley steerin' wheel Xan got me feel like I'm on a Ferris wheel They came 'round the neighborhood with that fire paint He got 'em on drop top just like a stingray My nigga came with 'em bails, that shit was green day I play the star role juggin' like in a screenplay God My newest bitch say that she got it, ya digg? Show me your mill, I put my sig in, ya digg? I want that pussy, cause it's as tight as a kick Look at my rollie, it's as cold as a fridge Push your top back cause I feel like it a wig I don't know why, I don't why, but I did I don't know why, I don't why, yeah But can you hurry up and buy, yeah"
"78","Slime Season 2"," hey i "," Get it I think she ready for a kiddy She told me she gon' make me miss her She let me wet her whole lil' ceiling My dick like crack so yeah I'm dealing She gotta love him, Peter Griffin Nut on the front of her head like I'm Eddie Griffin I make it count, I'm a star and she can make a wish I'm going down with her hard till I'm addicted Where the fuck you going girl? I miss you I wanna bang like a pistol I wanna bang like a crip do I'm banging red like soo woo, ooh Brand new rollie I'm living sporty Flood you with gold like a trophy She still the bomb, call her lotus Hey, racks keep me up with that Folger's I'm up, I'm up I might hit 'em with them bucks just in case he got luck This a Crime Mob lifestyle nigga knuck if you buck Just cause I'm in New York with a puck Don't mean you won't get stuck up, up Ay, I might just tell these hoes my secret First I like them red like a demon A purse, every time lil' momma catch me cheating Starburst, I won't eat it unless she creamy I think she ready for a kiddy She told me she gon' make me miss her She let me wet her whole lil' ceiling My dick like crack so yeah I'm dealing She gotta love him, Peter Griffin Nut on the front of her head like I'm Eddie Griffin I make it count, I'm a star and she can make a wish I'm going down with her hard till I'm addicted I, done completed my little mission I, put something in your stomach next to your kidney I, want nothing to do with none of these lil bitches I, want something to do with everything and I'm willing To go to church and ask God there for forgiveness For everything and tell that preacher that I'm gon' remember Him bringing You in my life and that's on my children Fuck all them other hoes talking, they Wendy Williams Now your wrist got ice like December I pour out the paint like Mutumbo I'mma fucking lion like Simba And, yeah my girl ballin' like Kendra I think she ready for a kiddy She told me she gon' make me miss her She let me wear her whole lil' ceiling My dick like crack so yeah I'm dealing She gotta love him, Peter Griffin Nut on the front of her head like I'm Eddie Griffin I make it count, I'm a star and she can make a wish I'm going down with her hard till I'm addicted"
"79","Slime Season 2"," she notice me "," The beat is produced by my nigga Wheezy That's one of my newest engineers... I mean, one of my newest producers I'm high, sorry I pulled up outside in that new big coupe body Benz When I dress myself I'm the topic, yeah the trend Unlike a needle I don't never wanna see the pen Pile all my yays and I better not never see the lens Fresh start, I wanna play, baby Come love a boss, you my babe, baby I'm eatin' like I ain't ate And I'm workin' like a maid Come through, won't you see me with my lenses I'ma trap it, pitch it, I'ma I press it, then I tint it I got falcons in the Honda Civic, I'ma get it I got dolphins in the fuckin' fender and they bending Help me eat Baby don't let me sit here and bleed I got Halloween, trick or treats up my sleeve You can't Future me because she know this me She know this me, she notice me She know Young Thugger Thugger She notice me, she notice me She know Young Thugger Thugger She notice me, she notice me She know Young Thugger Thugger She notice me, she notice me She know Young Thugger Thugger I don't know too many bitches that know I write Hand on me, suck on my dick I'ma pull my dick straight outta my boxers Then she gon' start suckin' like ticks She be the truth when she suckin' that dick And she wanted my milk like a W.I.C She don't play games and she don't go no kids But lil mama say that I'm it Ice is drippin' like a faucet I am hotter than a Taki Fifth pocket, look like a wallet Woah, woah no Kemosabe I got Ms like talkin' Miley And I'm still hot like a pocket Baby girl suck on my balls like a basket Get a nigga out of dental, tragic Lil mama my money stretch like elastic No rubber, I might just use plastic I'm a real boss, I'ma fuck her and leave her in dirt Like a muh'fuckin' Maverick And I got lucky, I'm lucky muh'fucka I might just go play for the Celtics I'ma run up with no helper If I get dealt with, get dealt with Bitch I'm a muh'fuckin' killer Earring bigger than a pillow Eat your main bitch like a Skittle Buy my Burberry at Dillard's Boy you know that you not realer, a thriller Boy you know that you're not built like that Hit you with 3 like Reggie Miller Mama askin' how he kill like that Big old body Benz She wanna fuck me in my big old body Benz She need to suck me in my big old body Benz I won't stop and I won't end I swear, I promise I pulled up outside in that new big old body Benz When I dress myself I'm the topic, yeah the trend Unlike a needle I don't never wanna see the pen Pile all my yays and I better not never see the lens Fresh start, I wanna play, baby Come love a boss, you my babe, baby I'm eatin' like I ain't ate And I'm workin' like a maid"
"80","Slime Season 2"," all over "," Swag all over my body all on my shoes Aayy, eh, eh Killin', I'm killin' these niggas, I'm breaking that news Aayy, ayyy Swag all over my body all on my shoes You know Metro higher than a mountain where my dew Ay, I got swag all on my motherfucking shoes You know I got swag all on my motherfucking shoes Bumbaclot pass me the rock Ayyy, thug life like Pac Ayyy, 32 rounds in that Glock Bumbaclots, state trooper tried to catch a nigga with the Glock Tell 'em mind they business bitch I'm tryna run a shop Pussy nigga going loose lips so I bought a mop Anytime they come down at me I get to first like I had to stop Take me a trip to Colorado to smoke moon rocks No way, no way No way, she can't leave me You can't leave me She's not from Georgia but she a peach Swag all over my body all on my shoes Aayy, eh, eh Killin', I'm killin' these niggas, I'm breaking that news Aayy, ayyy Swag all over my body all on my shoes You know Metro higher than a mountain where my dew Ay, I got swag all on my motherfucking shoes You know I got swag all on my motherfucking shoes I'm swagging from head to toe buzzin' I got so much weed in my blunt I could make a fucking mullet You lil' niggas are fake actors we just call ya puppets I don't move unless it's about money, I jump like ribbit Rabbit, rabbit, bitch I'm jumping like ribbit And I'm twice as green, ya dig? I got hella kids, ya dig? And they roll my weed, ya dig? Aayy, ya dig? Ya dig? Do ya dig? Swag all over my body all on my shoes Aayy, eh, eh Killin', I'm killin' these niggas, I'm breaking that news Aayy, ayyy Swag all over my body all on my shoes You know Metro higher than a mountain where my dew Ay, I got swag all on my motherfucking shoes You know I got swag all on my motherfucking shoes"
"81","Slime Season 2"," twerk it "," Thugger, baby, ahy, ahy I ain't goin' back and forward with 'em bro You, know what I'm sayin'? Ayy, ayy, ayy, ayy Girl, girl, twerk it for me baby Twerk it for me baby, twerk it for me baby Twerk it for me lady Twerk it baby, twerk it Baby twerk it, you better twerk it Twerk it, twerk it, twerk it, twerk it Twerk it, twerk it, twerk it, twerk it Twerk it, twerk it, twerk it, twerk it Twerk it, twerk it, twerk it, twerk it I'm in the kitchen just wrappin' I'm rappin' on bill like a motherfuckin' cypher I'm in the city, I got some lil bad hoes, they gonna pull up like a diaper If I'm ever gettin' mad man I swear I need only one shot like a sniper I'mma hit it from the back cause she told me that I was on fire like a lighter This is the sequel and I am so drowned in his ice like a motherfuckin' penguin I can't respect you cause you like my son, I just might name you Phoenix I said again baby, I'm livin' cold Plus I keep scraps for my heater I be King Slime cause I'm wipin' your nose Creep up in grass like a creature Pass that lil bitch to my whoadie, my whoadie I pass that lil bitch to my broadie I care that lil bitch down back at the concert and I just might make 'em show it Livin' it up man, I'm livin' so worry and I feel free like a birdie Told that lil baby do not get discouraged get in the room and start twerkin' Girl, girl, twerk it for me baby Twerk it for me baby, twerk it for me baby Twerk it for me lady Twerk it baby, twerk it Baby twerk it, you better twerk it Twerk it, twerk it, twerk it, twerk it Twerk it, twerk it, twerk it, twerk it Twerk it, twerk it, twerk it, twerk it Twerk it, twerk it, twerk it, twerk it Show me what you worth, baby Show me you deserve, baby Baby girl show me what you need I'm gonna help you succeed Climb in that cat like a lion I'ma mix this shit up like a liger I got drugs, I'm a well known supplier I got a viper not made out of fiber Ayyyy, skrrt, skrrt, skrrt, skrrt Shot to the head: goodnighter Gamblin' all night got my whole body sore no diner Thugger got pure coke, I snort it Every ho I fuck I make sure they go through my brother All these pussy nigga pies, I'm callin' 'em custard She want my hot dog with extra chili no usher She want Thugger Girl, girl, twerk it for me baby Twerk it for me baby, twerk it for me baby Twerk it for me lady Twerk it baby, twerk it Baby twerk it, you better twerk it Twerk it, twerk it, twerk it, twerk it Twerk it, twerk it, twerk it, twerk it Twerk it, twerk it, twerk it, twerk it Twerk it, twerk it, twerk it, twerk it Show me what you worth, baby Show me you deserve, baby Baby girl show me what you need I'm gonna help you succeed"
"82","Slime Season 2"," phoenix "," Thugga, baby I won't move without my gun, yeah And it's cause I'm the one She wanna fuck my charms Hell yeah But I never told her that I wanna be with her And I never told her that I wanna sleep with her And I never told her that she gonna eat with me Only thing I told the girl is she could bleed with me If she don't like it she don't see it And she soft I call her Tempur-Pedic And I can work magic like a genie You can have my son, no Phoenix Ay, lil momma showing me she don't play And she never diss her old boy, no way And I never told her nothing bout bae And every time I leave she want me to stay But she just don't know how to say And that's deep but I could say Anything I want, I run the day, whoa Hand her my taste, cum on her face Drank all her waste, okay, mush it not beat it Hakuna Matata I need it,I am a Mufasa genius Baby come fuck for no reason I am the opposite, I'm so the opposite B I'm the opposite baby I know some Haitians and they cookin' babies, um, ay I meet the momma and meet the grandmomma when I wanna fuck the lil' lady She ran my water then cook all my food now I feel like I done fucked a waiter I won't move without my girl, yeah And it's cause I'm the one She wanna fuck my charms Hell yeah But I never told her that I wanna be with her And I never told her that I wanna sleep with her And I never told her that she gonna eat with me Only thing I told the girl is she could bleed with me If she don't like it she don't see it And she soft I call her Tempur-Pedic And I can work magic like a genie You can have my son no Phoenix Started from the top then I fucked her little bottom I'ma nut on her booty she a Prada I'm on her institution now I got on my goggles Baby girl get on my boat no Nautica, whoa Grab that dick eight fucking ways like a motherfuckin' octopus I'ma fuck that lil bitch and listen to 2Pac Call the lil bitty bitch when I wanna do her Baby girl I'm hood rich and I put my crew up Leave that bitch in a ditch and they wanna sue us She's a barber, the bitch saying her crew cut Put my dog in your poo butt Laying down law with my Russians No stomach, came out the gutter Where the hell I'll be without my baby When she send me pictures everything's the latest I wanna fuck her without raping And she'll pull up on you, no baby I won't move without my gun, yeah And it's cause I'm the one She wanna fuck my charms Hell yeah But I never told her that I wanna be with her And I never told her that I wanna sleep with her And I never told her that she gonna eat with me Only thing I told the girl is she could bleed with me If she don't like it she don't see it And she soft I call her Tempur-Pedic And I can work magic like a genie You can have my son no Phoenix"
