"","Album","Song","Lyrics"
"43","1017 Thug 3: The Finale"," around my way "," Big old titties, my favorite Put a big B on your head like you a raven Never ever get you too tired, we’re not laces And you know a young nigga more streeter than a pavement Bitches just pay me that pussy, bitches just want have my children Bitches know I’m just not with it, I’m gonn' watch her while she dishing You know I’m not with the Girl Scouts But I’m just smoking on cookies Tripping cause you brought your girl out I'm gonn' touch her when you ain’t looking She like Mitsubishi, with the motherfucking secrets Fuck her every weekend, all four pockets, just Monique'n Tell me baby mommy, 20k thown at Onyx She want some my money, so you know I’m pulling the tommy Woah there, just stare Can’t move, wheelchair Woah yeah, got pocket full of them faces Rolling just like a rolly polly, ole You know you gonn' get it round my way Gone fuck around, you gone fuck around You gone get it round my way-ay,-ay Gone fuck around, you gone fuck around You gone get it round my way You ain’t never took those trips in the rental back and forth Up and down the interstate, trying to get it Surrounded by young rich niggas, call us gorillas Untouchable, we walk right in the club with them pistols Turn a mug into a mushroom, DK get another sprite Run up on 'em close range, that bezel another life These niggas don’t want no problems, we solve 'em with 15 carbons They gone think it’s a madness the way we marching And we keep it on us, ain’t no way you robbing Any questions come my way, man we got to solve em Keep one in the hand, so ain’t no cocking P-R-O-B-L-E-M, they don’t want no problems Woah there, just stare Can’t move, wheelchair Woah yeah, got pocket full of them faces Rolling just like a rolly polly, ole You know you gonn' get it round my way Gone fuck around, you gone fuck around You gone get it round my way-ay,-ay Gone fuck around, you gone fuck around You gone get it round my way"
"44","Barter 6"," constantly hating "," Pour that shit up fool, the sauce Monster! Man so you ain't gonna pour? Oh so you're gonna make a nigga beg you to pour? Okay bool. You dig? (Wheezy Beats) Hopped out my mothafuckin' bed Hopped in the mothafuckin' coupe (SKRRRRR) Pulled up on the Birdman (BRRRRR) I'm a beast, I'm a beast, I'm a mobster You got 50 whole bands, you'll be my sponsor (just for the night) Them snakes on the plane, me and Kanye-conda (condas) Yeeeah... (them anacondas) I might piece him up and let my partner smoke him Chuck-E-Cheese him up, I pizza him, I roll him I'm a gangster, I don't dance, baby I poke Right now I'm surrounded by some gangsters from Magnolia I heard I put it in the spot, yessir she told me My niggas muggin', these niggas YSL only I heard my Nolia niggas not friendly, like no way But we not friendly either, you know it Ha! Yeah, thumbs up I've seen more holes than a golf course on Donald Trump’s course My bitch a tall blooded horse, nigga, bronco And if you catch us down bet you're not gon' trunk us You got a body, lil nigga, we got a ton of 'em You got some Robin's, lil nigga, we got some Batmans I let that choppa go ""blocka, blocka,"" get back, son You got them MJs, nigga, I got them Jacksons (racks) But really what is it to do When the whole world constantly hatin' on you? Pussy niggas hold their nuts, masturbatin' on you Meanwhile the fuckin' federal baitin' on you Nigga tell me what you do Would you stand up or would you turn to a pussy nigga? I got a hundred things to do And I can stop rappin' but I can't stop stackin' fuckin' figures Yeah, I'm from that mothafuckin' 'Nolia, nigga Birdman'll break a nigga nose, lil' nigga You need to slow your fuckin' roll, lil' nigga We created Ks on shoulders, nigga I'm a scary fuckin' sight, lil' nigga We won a hundred mil' on fights, lil' nigga A hundred bands, sure you're right, lil' nigga I keep some AKs on my flights, lil' nigga Birdman Willie B Smoke some stunna blunts, now my eyes Chinese Hundred K on private flights overseas Choppas City nigga, free BG Bentley with the doors all 'round, not a Jeep Rich nigga shit, smoke two pounds in a week Can't find a bitch that don't know we them streets Bitches know that I am Birdman, that's OG But really what is it to do When the whole world constantly hatin' on you? Pussy niggas hold their nuts, masturbatin' on you Meanwhile the fuckin' federal baitin' on you Nigga tell me what you do Would you stand up or would you turn to a pussy nigga? I got a hundred things to do And I can stop rappin' but I can't stop stackin' fuckin' figures Nigga I'm a crack addict Thought about lettin' them get a cut Then I went and snagged at it The new Boosie Badazz at it I'ma drop a nigga life, just like a bad habit I stick to the ground like a mothafuckin' rug I'm a big dog, lil' fuck nigga you a pup Lil' bitch clean your drawers before you think you're a thug Before I be in front your shows, just like your pub I ain't even lyin', baby I swear to God I ain't lyin', baby, nooo First I'll screw you without these pliers, baby I might dap you like, ""good try, baby"" Big B livin', baby Them boys on my left throwin' up Cs I promise their mama see them this week And I don't break promises with my Ds (them my dogs) I want Ms and cheese, mister Mickey Ds She know I am a beast, I am so obese In Miami I swear they don't got good weed Wiz Khalifa can you send me some weed please? Yeah, overseas, nigga, top floor, clear windows, nigga Glass house, drankin' GT, you understand? We in that Red Light District, you understand? 3 and 1, that mean 3 on me, nigga, you understand me? Just livin' the life, boy, aye Thug, just a dollar for a 1, nigga We can blow a mil', boy. Rich Gang, YSL, blatt!"
"45","Barter 6"," with that "," Hunnid' bands, hunnid' bands Dropped on the head of any nigga want it man Pop me a Xannie I'm fast I'm so fast, I'm so faster than Sonic man True the man, true the man, true to my nigga True religion, Buddha man My money stack tall as Ludacris afro And I swear I'ma shoot with that I just hit for 9 birds, what I'ma do with that? Pull up on the curb, then you hop out and be through with that I'm so fresh like dish detergent If you not fresh you so through with that If you are a nerd, everything here you not cool with that Yes you not cool, no you not bool I don't give no damn I'm not calling you boo My bitch she a jewel You can't prove a point, boy you know you so doomed You know you so doomed I swear I'm so lost with no clue, don't know what to do Over loud, over loud I over loud on these niggas Ain't know how to milk these cows She made that dick grow now it's big like a tower Yaow, front pockets filled up with bands, no Bible Hunnid' bands, hunnid' bands Dropped on the head of any nigga want it man Pop me a Xannie I’m fast I'm so fast I’m so faster than Sonic man True the man, true the man, true to my nigga True religion, Buddha man My money stack tall like Ludacris afro And I swear I'ma shoot with that I just hit for 9 birds, what I'ma do with that? Pull up on the curb, then you hop out and be through with that I'm so fresh like dish detergent If you not fresh she so through with that If you are a nerd, everything here you not cool with that Pull up, hop out the block They tuck in they tail, I go ""who the clan?"" Dressed in all black, I'm always on the road, just like a Uber man We wrappin' and sendin' them packs Soon as they land we movin' em Blame it on the OG's, they influenced me (I'm riding with felons) Ain't gonna count money nigga, I ain’t juh met money, nigga I put lipstick on the 'rari, she say that's delicious Who that is in that Crown Vic, he look suspicious (Shhh) I just jugged 100 pounds, I made a... Hunnid' bands, hunnid' bands Dropped on the head of any nigga want it man Pop me a Xannie I’m fast I’m so fast I’m so faster than Sonic man True the man, true the man, true to my nigga True religion, Buddha man My money stack tall like Ludacris afro And I swear I'ma shoot with that I just hit for 9 birds, what I'ma do with that? Pull up on the curb, then you hop out and be through with that I'm so fresh like dish detergent If you not fresh she so through with that If you are a nerd, everything here you not cool with that Yeah you not cool with that You not cool with that You not cool with that Yeah"
"46","Barter 6"," can t tell "," Eh Can't tell, yeah Niggas say they fuck with you, I can't tell, $500,000 Chevelle I got bricks and birds for retail, I got 100,000 worth of belts These bitches and these niggas know that they can't play around here I call the spot elementary cause I keep a K around here All my Aces if you play they make you grady baby I might shoot you in your head and then it's no more thinking Pussy boy I'll leave you dead and call it dead-ication I put Act inside my drink, they call it medication Hold up, pull up, roll up, pour up, ounces in a soda Push up on your bitch and shawty I didn't even know her See this hood I throw up, realest one I ever seen ATL, call it XXL, cause we stay spittin' shells outta long magazine Real nigga got a crown, better own that thing If the game got a throne, bet I'm on that thing Beloved dope dealer and a well known King And a killer 'pending on how you put your spin on things You know how many suckers get ahead I've seen? Bout the same amount of pussy niggas dead I've seen You know how many bitches in the bed I've seen? That like asking me how much bread I've seen More than enough, in God we trust You love a real niggas then fuck with us But if you got a problem with it then fuck with us It be ashes to ashes, dust to dust Got your bitch riding everything but the bus She let me put it everywhere but the butt I always tell the bitch don't talk so much She said ""Who I'm hidin' from? What the fuck, for what?"" Niggas say they fuck with you, I can't tell, $500,000 Chevelle I got bricks and birds for retail, I got 100,000 worth of belts These bitches and these niggas know that they can't play around here I call the spot elementary cause I keep a K around here All my Aces if you play they make you grady baby I might shoot you in your head and then it's no more thinking Pussy boy I'll leave you dead and call it dead-ication I put Act inside my drink, they call it medication Man I'm leanin' so bad I can't do a push up for a million (Lean, lean, lean, lean, lean) Catch a nigga baby mama Make her give me nothing but ceiling (head) Never had time to rap and cap And dap these tramps, my ice a lamp I can't adapt, I'd rather slap I rather pop his cap and naps His mom, his aunt, his dad, his cat 2004 I was screaming everything Gucci, no Big Cat And we was skatin' up, ridin' with the K's Shootin' at all these big racks Fuck a officer, Akon what it do bruh? Keep these fuckin' hoes off of you When you get some new money turn new or You gon' wish you would've, could've (waaaay) Sit down and get rich like a booker Might drop the top up off it If I don't get into the helicopter Feeling like I'm on a blue dolphin Nigga ridin' round with like hella choppers Every time I need new surgery I gon' call up my head doctor 5 more thousands cause she ain't got no head problems (She the best, she the best) Yeah, all my niggas they be bleedin' nigga They ain't gon' never cheat a nigga Pop a watermelon any season, nigga I'ma bag her every time I see her, nigga Fishing hoes with my hook Pockets all swollen, no book Glasses on, she don't know how I look (nerdy, nerdy) Since I'm on how the fuck do I look? (I'm on, I'm on) You ain't got no milli, you can't tell me how I look I'm a big old Blood over here, I'm Suge Niggas say they fuck with you, I can't tell, $500,000 Chevelle I got bricks and birds for retail, I got 100,000 worth of belts These bitches and these niggas know that they can't play around here I call the spot elementary cause I keep a K around here All my Aces if you play they make you grady baby I might shoot you in your head and then it's no more thinking Pussy boy I'll leave you dead and call it dead-ication I put Act inside my drink, they call it medication You ain't read the paper, you ain't seen the news Got a team of goons bout action Never start it, but I finish it so nasty Ask em, they know bout me I'm so Keyshia with the 9, rock a bye baby So smooth, so fly baby, rock a bye baby Let me turn up now, 4 shows a week 100 thousand a piece, we getting bread now Mama don't worry bout nothin' You can kick up your legs now I ain't lying, got hitters on top of hitters Got hitters on top of hitters Rest in peace to my nigga Lil Bleek I miss you, I miss you nigga Just tryna live and have a lil fun nigga Nephew just came home, half a million dollar bond nigga I got fans that bust yo ass, you talk bout Boosie baby Got off my ass, went got that bag and Boosie made it Hate that, nigga Niggas say they fuck with you, I can't tell, $500,000 Chevelle I got bricks and birds for retail, I got 100,000 worth of belts These bitches and these niggas know that they can't play around here I call the spot elementary cause I keep a K around here All my Aces if you play they make you grady baby I might shoot you in your head and then it's no more thinking Pussy boy I'll leave you dead and call it dead-ication I put Act inside my drink, they call it medication"
"47","Barter 6"," check "," I can see that bullshit from a mile away (see it) You can stack my money bout a mile away (stack it) I got three white bitches like it's powder day (white) Mink coat with the rolls like a Shar Pei And all of my bitches sexy, call them Barbies She lookin' back like I'm flexin', baby no way And lately, I been on that D'usse, yee Got me a check, I got a check Yeah, I done got me a check, I got a check (sheesh, sheesh) Yeah, I done got me a check, I got a check (sheesh) Yeah, I done got me a check, oh, got a check (yeah, yeah-yeah!) Money on my mind, I got money on my brain Money in my pants, I got money I call change 20, 50, 100, 500 millions made Big hunna Thugga, screamin' free that Gucci Mane If I need some racks, I'ma flip me some packs I talk like I want and she don't say nothin' back If cops pull up, I put that crack in my crack Or I put that brack in my brack Call little shawty, made her fuck on my brodie If you don't owe me, bitch, still act like you owe me I promise I won't ever quit, bitch I'm Kobe And I whip that white, you can snow me Stoner Young Thugger I whip it, that bitch, yeah, she know me Young Thugger Yeah, she shinin' like butter The bitch from Chicago, I call her young Cutler Leave it to Beaver I pull up in Bentleys with London, they all want to meet him Yeah, they all wanna greet him They pull down they pants and they all wanna eat him, uh No, they won't tease on that dick They won't read on that dick, they won't leash on that dick Don't Felicia that dick, Mamacita that dick They gon' snitch on that dick And she screamin' loud, she can't secret that dick Mama a beast on that dick If she bad, I'ma gon' an' Four Season that bitch Eat that lil bitch, I'ma feast that lil bitch, mm I got me a check, I got a check Yeah, I done got me a check, I got a check (sheesh, sheesh) Yeah, I done got me a check, I got a check (sheesh) Yeah, I done got me a check, oh, got a check (yeah, yeah-yeah!) Money on my mind, I got money on my brain Money in my pants, I got money I call change 20, 50, 100, 500 millions made Big hunna Thugga, screamin' free that Gucci Mane Bitch I'm a Migo, I play with kilo When I put ice on, I am Sub-Zero All of my niggas, they hard, call 'em beetles Niggas was fake so I kept me a Ruger in Regals Droppin' the top on the Bentley I'm with the Birdman, yeah the eagle Geeked out my mind, man I'm tripping out I don't know none of these people Make my little shawty go get me a four and bring back me a liter Yes, I got threats, I'm not worried 'bout that They know they can get whacked and I swear I done Got me a check, I got a check Yeah, I done got me a check, I got a check (sheesh, sheesh) Yeah, I done got me a check, I got a check (sheesh) Yeah, I done got me a check, oh, got a check (yeah, yeah-yeah!) Yeah I'm like, baby baby baby, I need racks Baby baby, baby baby baby, I need racks Baby baby, baby baby baby, I want racks Baby baby, baby baby baby, I need racks, hey!"
"48","Barter 6"," never had it "," Yeah, yeah Yo, yo YSL Pussy niggas actin' like they never had shit All these bitches actin' like they never had shit I got a bad bitch, she said she always had shit All these flawless diamonds, yeah they're lookin' glassy Catch that nigga slippin', I'ma do 'em nasty Check out my attire, this expensive fabric And we can wrestle just like Randy Savage My jewelry as cold as an attic The kushy that I smoke'll blow your lungs out I'ma walk in and clutch it like it's a war house All your bitches thats busted, they live in your house What goes up comes down, my nigga, north south I done ran up them M's without a tour now She done stepped up her game, Christian couture now These niggas thought that they knew it but they don't know it now I swear to God they're pursuin' at all my shows now Ayy, hopped out my 'vette and hopped right in a foreign Ayy, bitch don't get close, this a mothafuckin' warning Ayy, suck that dick good, I'm the mothafuckin' warden Ayy, she runnin' away from my weed like it farted She don't wanna swallow so I put it on her neck I beat that pussy up, she loud as a parade I got 1 million but only 10 in the bank I taste a sample, I only buy if it's dank I cook fishscale, and sang to her same time like Tank I was born in '91, 23 years old with a whole lotta stain (5 star mothafucka) Baby can you feel my pain? All my diamonds need to be drained I got a gangsta bitch that's gon' bang And I got racks up, I can't complain And all my dogs, they're dirty, check for mange And all I gotta do is reserve your brains And I'm a gangsta, my nuts, they gon hang Who said you was straight? Boy you need to be retained Pussy niggas actin' like they never had shit All these bitches actin' like they never had shit I got a bad bitch, she said she always had shit All these flawless diamonds, yeah they're lookin' glassy Catch that nigga slippin', I'ma do 'em nasty Check out my attire, this expensive fabric And we can wrestle just like Randy Savage My jewelry as cold as an attic The kushy that I smoke'll blow your lungs out I'ma walk in and clutch it like it's a war house All your bitches thats busted, they live in your house What goes up comes down, my nigga, north south I done ran up them M's without a tour now She done stepped up her game, Christian couture now These niggas thought that they knew it but they don't know it now I swear to God they're pursuin' at all my shows now Took the Rollie off, put the Breitling back on Walk in the room and I cut the lights on Why you spendin' like that? Cause I ain't never had shit This that real nigga Paper Route, YSL shit Never loved a bitch but I love money In the church payin' my tithes with drug money, thank you Went and got a new plug, got mama a new house And a couple new coupes, that's how a young nigga live Couple bitches, good weed that how a nigga chill Top floor, penthouse, still crackin' seals Them Houston niggas be like, ""That young nigga trill"" Them New York niggas say that young nigga ill...it's Dolph My mama always told me dress to kill Hey, my uncle always told me pack the steel Hey, that nigga Thugger, that's my mothafuckin' brotha From a motherfuckin' 'nother, I'ma show you how to make magic The fuck is you mad at? Got your bitch dancin' all in my spot with no panties I said, ""Bitch where your mothafuckin' man at? Fuck that, where your friends at?"" Dammit Sold 50 P's, hold it, have to bag it That little bitch you lovin' on, I been had it Pull up in a new drop, that thang nasty Mama call all my big booty bitches trashy Pussy niggas actin' like they never had shit All these bitches actin' like they never had shit I got a bad bitch, she said she always had shit All these flawless diamonds, yeah they're lookin' glassy Catch that nigga slippin', I'ma do 'em nasty Check out my attire, this expensive fabric And we can wrestle just like Randy Savage My jewelry as cold as an attic The kushy that I smoke'll blow your lungs out I'ma walk in and clutch it like it's a war house All your bitches thats busted, they live in your house What goes up comes down, my nigga, north south I done ran up them M's without a tour now She done stepped up her game, Christian couture now These niggas thought that they knew it but they don't know it now I swear to God they're pursuin' at all my shows now"
"49","Barter 6"," dream "," A young nigga's life is a dream (yeah) We ain't lettin' no hoes get between (us) When my diamonds speak, they say ""bling"" (yeah) Yellow diamonds, no crime scene (yeah) This that rich shit, I eat fish and grits Catch me boolin' with my dogs, just like Michael Vick I don't give no damn if they throw it off, I won't fuckin' miss Bitch I'm so up, no Sleepy Brown, wouldn't talk to him 'bout shit (Ya dig?) I want you to talk to the hand while I talk to bands I might gone and stop playing, take over the lands My money long as school buses ain't talkin' no Xans Sit still, I'm cool coming, pull up and then spray it 50 dub, know I'm sayin'? 100 bloods in my fam 100 bloods, they not fans, fuck the beach, I got sand PS3, I'm not playin', go gentle on my lil' man She wanna stay where I'm stayin', I'm booted up, I could land My car is fast, I should drag, Versace white, Ku Klux Klan Don't care if he's Crip, he still fam, no A.M., bitch, I am But when I do I might need help up And I wanna be like Mike and I ain't talkin' Phelps, but A young nigga's life is a dream (yeah) We ain't lettin' no hoes get between (us) When my diamonds speak, they say ""bling"" (yeah) Yellow diamonds, no crime scene (yeah) This that rich shit, I eat fish and grits Catch me boolin' with my dogs, just like Michael Vick I don't give no damn if they throw it off, I won't fuckin' miss Bitch I'm so up, no Sleepy Brown, wouldn't talk to him 'bout shit (Ya dig?) Hey how you doin'? I'm Yak Gotti, I got bodies on bodies I'm with Thugger, that's my woadie, yeah my round That's my compadre And we solid, oh so solid, if I get caught I won't say nothin' YSL, bitch we mobbin', I'm forreal, this beat knockin' Trigger, boy I got you, Rico, boy I got you I'm livin' out my dreams, broke is not an option Yeah I'm livin' out my dreams, broke is not an option A young nigga's life is a dream (yeah) We ain't lettin' no hoes get between (us) When my diamonds speak, they say ""bling"" (yeah) Yellow diamonds, no crime scene (yeah) This that rich shit, I eat fish and grits Catch me boolin' with my dogs, just like Michael Vick I don't give no damn if they throw it off, I won't fuckin' miss Bitch I'm so up, no Sleepy Brown, wouldn't talk to him 'bout shit Ya dig?"
"50","Barter 6"," dome "," I got like 5 million and 12 hundred thousand hoes They drippin' all over my motherfuckin' clothes Let's go off the dome, I can't make it home I fucked her, I boned her, she leave an aroma They calling my phone up, my girl like ""What's going on?"" She sucking, put me in a coma, I nut on that fish on my sofa Yeeeeeah (yeah yeah yeah yeah) Yeeeeeah (yeah yeah yeah yeah) Yeeeeeah (yeah yeah yeah yeah) What's brackin' Dickie suit, chucks Flag hanging to the right Put that young bitch in a bucket Kid Cudi, fuck her all day and all night Ok, I'm in this bitch with lil Duke, Longway You can be with me, you too, four way Put that bitch off from my deuce, slow day I'ma sell at least like 2 Thugga Thugga what it do Riding in the fast lane, I'm eluding (Skrrr) All these drugs that we abusing (drugs) Addicting to winning, not losing I'm in the kitchen just cooking (cook it up) Middle finger to a bookin' (fuck em) Fuck running off, fuck nigga I took it Diamond so wet, I might need to douche it Diamonds they shower, they shower me Yes that lil nigga I got with me When it's war my niggas count on me Beyoncé bitch I'm a bumble bee This the B-hive, this my turf bitch, you can't sting on me Jingle bells, baby you can ring on me Let's go off the dome, I can't make it home I fucked her, I boned her, she leave an aroma They calling my phone up, my girl like ""What's going on?"" She sucking, put me in a coma, I nut on that fish on my sofa Yeeeeeah (yeah yeah yeah yeah) Yeeeeeah (yeah yeah yeah yeah) Yeeeeeah (yeah yeah yeah yeah) What's brackin' 458 California 'Rari I got that old money, call it Atari Let's go off the dome, I trap by the Dome Keep a couple grams in my fifth pocket Keep a pocket rocket on me Ain't no guessing if I'm gon' pop it Got a lot of blood homies And guess what it ain't no stopping Hop in the car and I'm wyling, I'm styling I hop out and cuss out my driver Fuck nigga try me, no Eddie Bauer I'ma pull up and make it rain, showers I'ma lil kid when it come to that pussy I hop up like the Icy Tower (hop up) I would rather be a coyote than be a coward I creep right up on them Hit em with the AK, 7 in the morning (pew pew)No Christmas Eve Caught him by surprise, he was still yawning I'm running the city You riding in that loaner, I'm running with owners I'm running with armor I'm not even thinking I'm right off the dome Let's go off the dome, I can't make it home I fucked her, I boned her, she leave an aroma They calling my phone up, my girl like ""What's going on?"" She sucking, put me in a coma, I nut on that fish on my sofa Yeeeeeah (yeah yeah yeah yeah) Yeeeeeah (yeah yeah yeah yeah) Yeeeeeah (yeah yeah yeah yeah) What's brackin'"
